index,username,acctdesc,location,following,followers,totaltweets,usercreatedts,tweetcreatedts,retweetcount,text,hashtags,mentioned_users,cleaned_text,sentences_tone,document_tones,joy,analytical,sadness,tentative,confident,fear,anger
4244,MaryamHenein,"investigative journalist. #covid19 coverage. in future. 
i blew the whistle on #bayer/#neonics: director @vanishingbees, narrated by @ellenpage/ fm consultant",censored. follows appreciated,4921,17207,33714,2009-10-08 19:36:41,2020-06-20 03:14:23,14,"@kswood007 @TomFitton @POTUS @SpeakerPelosi @BarackObama @BillGates @georgesoros @WHO @Merck @cnnbrk @maddow @CNNnewsroom @JackPosobiec @Facebook ...And as mysteriously as CORONA VIRUS PANDEMIC HOAX appeared, it suddenly VANISHED out of thin air - just like @realDonaldTrump predicted.
Anyone remember that?

https://t.co/X5kbjIY6pe

RUSSIAN COLLUSION
IMPEACHMENT HOAX
PANDEMIC HOAX
RIOTING &amp; LOOTING by @DNC 

#Plandemic 😂🇺🇸",[],"['@kswood007', '@TomFitton', '@POTUS', '@SpeakerPelosi', '@BarackObama', '@BillGates', '@georgesoros', '@WHO', '@Merck', '@cnnbrk', '@maddow', '@CNNnewsroom', '@JackPosobiec', '@Facebook', '@realDonaldTrump', '@DNC']","mysteriously corona virus pandemic hoax appear suddenly vanish thin air like predicted.
anyone remember that?



russian collusion
impeachment hoax
pandemic hoax
rioting amp loot 

","[{'sentence_id': 0, 'text': 'mysteriously corona virus pandemic hoax appear suddenly vanish thin air like predicted.', 'tones': [{'score': 0.549669, 'tone_id': 'fear', 'tone_name': 'Fear'}, {'score': 0.946222, 'tone_id': 'tentative', 'tone_name': 'Tentative'}]}, {'sentence_id': 1, 'text': 'anyone remember that?', 'tones': [{'score': 0.955445, 'tone_id': 'analytical', 'tone_name': 'Analytical'}, {'score': 0.994446, 'tone_id': 'tentative', 'tone_name': 'Tentative'}]}, {'sentence_id': 2, 'text': 'russian collusion', 'tones': [{'score': 0.801998, 'tone_id': 'fear', 'tone_name': 'Fear'}]}, {'sentence_id': 3, 'text': 'impeachment hoax', 'tones': []}, {'sentence_id': 4, 'text': 'pandemic hoax', 'tones': []}, {'sentence_id': 5, 'text': 'rioting amp loot', 'tones': []}]","[{'score': 0.668457, 'tone_id': 'fear', 'tone_name': 'Fear'}, {'score': 0.987926, 'tone_id': 'tentative', 'tone_name': 'Tentative'}]",,,,1.0,,1.0,
4245,dangerdaysfrank,broken mirrors with odd reflections // aka toph aka prometheus // they // 22,n.a,116,20,1278,2013-08-22 04:21:35,2020-06-22 01:39:55,23754,Lack of taste is a symptom of covid-19 https://t.co/o2txxNFLn3,[],[],lack taste symptom,,"[{'score': 0.955445, 'tone_id': 'analytical', 'tone_name': 'Analytical'}]",,1.0,,,,,
4246,KShark13,the official twitter of https://t.co/el0rqzgxiz,n.a,661,304,8391,2012-01-10 06:12:59,2020-06-22 03:37:51,8286,"There were so many directions he could have gone- Covid-19, unemployment, the murder of George Floyd, systemic racism, global warming, etc. Instead he chose the ‘whiny victim’ route. THIS is our president????? We deserve better. Register to vote. https://t.co/zMdYhSBOMh",[],[],many direction could go unemployment murder george floyd systemic racism global warm etc instead chose ‘whiny victim’ route president deserve good register vote,,[],,,,,,,
4247,kingof_peace,we live in 1993 here.,"dublin, ireland",1220,250,14447,2010-11-29 20:54:44,2020-06-22 03:20:33,726,"46% of global Covid-19 deaths are recorded in 3 countries, which only account for 7.8% of global population.

What do they have in common? https://t.co/PqAHY0lAnI",[],[],"global death record country account global population.

what common","[{'sentence_id': 0, 'text': 'global death record country account global population.', 'tones': []}, {'sentence_id': 1, 'text': 'what common', 'tones': []}]",[],,,,,,,
4248,aoifegranville,bainisteoir @ionadculturtha musician. ucc graduate. phd. lecturer in another life! knitter & gaa enthusiast! is liomsa amháin na tuairimí anseo.,dingle/daingean uí chúis,3492,2450,10862,2009-12-16 21:12:36,2020-06-22 01:20:42,4,"ICYMI: Arts Council Publishes Report of Advisory Group on Covid-19 and the Arts
https://t.co/ChYUjqo91T https://t.co/EkTvcASWS7",[],[],"icymi art council publish report advisory group arts
",,"[{'score': 0.704642, 'tone_id': 'confident', 'tone_name': 'Confident'}]",,,,,1.0,,
4249,jsmn_aqn,人生は短すぎる、あなたを幸せにすることをする,sin city,131,142,3113,2017-08-13 00:51:46,2020-06-21 03:32:47,1264,huhuhu I really miss how life was before the corona virus 🥺👉🏼👈🏼,[],[],huhuhu really miss life corona virus,,"[{'score': 0.88846, 'tone_id': 'sadness', 'tone_name': 'Sadness'}, {'score': 0.842108, 'tone_id': 'analytical', 'tone_name': 'Analytical'}]",,1.0,1.0,,,,
4250,bloomimgdale,n.a,united states,918,178,6533,2017-09-10 02:00:31,2020-06-20 03:13:41,25980,"Trump's rally in Tulsa is indoors, with no social distancing and no mask requirements—all in violation of CDC guidelines. Trump is willing to spread the COVID-19 virus in order to hear some cheers. He is a direct threat to the health of the American people. He must be defeated.",[],[],trump's rally tulsa indoors social distance mask requirements—all violation cdc guideline trump willing spread virus order hear cheer direct threat health american people must defeat,,"[{'score': 0.642915, 'tone_id': 'analytical', 'tone_name': 'Analytical'}, {'score': 0.674728, 'tone_id': 'confident', 'tone_name': 'Confident'}]",,1.0,,,1.0,,
4251,sum1holdmeplz,jinkies baby,n.a,1013,1054,55045,2012-04-29 16:27:26,2020-06-22 01:21:53,6441,"There were so many directions he could have gone- Covid-19, unemployment, the murder of George Floyd, systemic racism, global warming, etc. Instead he chose the ‘whiny victim’ route. THIS is our president????? We deserve better. Register to vote. https://t.co/zMdYhSBOMh",[],[],many direction could go unemployment murder george floyd systemic racism global warm etc instead chose ‘whiny victim’ route president deserve good register vote,,[],,,,,,,
4252,pryankaa,"a writer. a wordsmith. loves jazz, contemporary art and everything in between.",india,2682,3601,19407,2009-04-18 12:21:26,2020-06-22 01:38:23,1035,"I live in Delhi and I have just recovered from #Covid_19!

I am a 30-year old male with no underlying health conditions. Just a few extra kilos, but hey, who in Delhi doesn’t have that. And still it took me 23 days to start feeling normal again!

A thread of my struggle..

(1/n)",['covid_19'],[],"live delhi recover 

i old male underlie health condition extra kilo hey delhi doesn’t still take day start feel normal again!

a thread","[{'sentence_id': 0, 'text': 'live delhi recover ', 'tones': []}, {'sentence_id': 1, 'text': '', 'tones': []}, {'sentence_id': 2, 'text': 'i old male underlie health condition extra kilo hey delhi doesn’t still take day start feel normal again!', 'tones': [{'score': 0.548904, 'tone_id': 'analytical', 'tone_name': 'Analytical'}]}, {'sentence_id': 3, 'text': '', 'tones': []}, {'sentence_id': 4, 'text': 'a thread', 'tones': [{'score': 0.762356, 'tone_id': 'analytical', 'tone_name': 'Analytical'}]}]","[{'score': 0.711937, 'tone_id': 'analytical', 'tone_name': 'Analytical'}, {'score': 0.664175, 'tone_id': 'tentative', 'tone_name': 'Tentative'}]",,1.0,,1.0,,,
4253,Malhidael,doors of dunera @scratticus_ | he/him | 🏳️‍🌈 queer | part time writer | full time dad | trans rights are human rights | https://t.co/0sas35k2ut | https://t.co/pyfb08yw1m,earth,361,753,47301,2010-11-10 21:53:39,2020-06-21 02:36:54,151,"When the President of the United States uses racist terms like Kung Flu, Chinese Virus, or China Plague, my biggest fear as an Asian American is that it normalizes racism against us and there’s no way for us to fight it. We have very little representation in government and media.",[],[],president united state us racist term like kung flu chinese virus china plague big fear asian american normalizes racism there’s way fight little representation government medium,,"[{'score': 0.552886, 'tone_id': 'fear', 'tone_name': 'Fear'}]",,,,,,1.0,
4254,NavneetBaitha,trainer/faculty with the art of living foundation. software engineer. speaker. sportsman. gamer. humanitarian. youth mentor. being happy &making others happy😃,"dehradun, india",274,348,21304,2010-09-09 19:21:22,2020-06-22 02:31:06,69,"#DharmaSammelanOnIndiaTV: Spiritual guru Sri Sri Ravi Shankar talks about the new way of living amid COVID-19 crisis
@SriSri @ArtofLiving  @journosaurav https://t.co/Am6uJGmNDF",['dharmasammelanonindiatv'],"['@SriSri', '@ArtofLiving', '@journosaurav']","spiritual guru sri sri ravi shankar talk new way living amid crisis
",,[],,,,,,,
4255,patricklsk,how i wished i was less educated and more ignorant of what is going on around me!,n.a,1219,5583,174748,2010-08-26 08:13:23,2020-06-20 02:59:37,25268,"Trump's rally in Tulsa is indoors, with no social distancing and no mask requirements—all in violation of CDC guidelines. Trump is willing to spread the COVID-19 virus in order to hear some cheers. He is a direct threat to the health of the American people. He must be defeated.",[],[],trump's rally tulsa indoors social distance mask requirements—all violation cdc guideline trump willing spread virus order hear cheer direct threat health american people must defeat,,"[{'score': 0.674728, 'tone_id': 'confident', 'tone_name': 'Confident'}, {'score': 0.642915, 'tone_id': 'analytical', 'tone_name': 'Analytical'}]",,1.0,,,1.0,,
4256,erimystax,ichthyologist at the university of minnesota #lgbtstem 🏳️‍🌈 🇨🇦,n.a,901,345,3408,2009-03-08 20:21:28,2020-06-22 02:32:33,1,Global Deaths Due to Various Causes and COVID-19 https://t.co/gJWQG1e2bs Visualised with @f_l_o_u_r_i_s_h,[],['@f_l_o_u_r_i_s_h'],global death due various cause visualise,,"[{'score': 0.690491, 'tone_id': 'sadness', 'tone_name': 'Sadness'}, {'score': 0.842108, 'tone_id': 'analytical', 'tone_name': 'Analytical'}]",,1.0,1.0,,,,
4257,rleb2005,1/2/1936,"covina, ca",48,12,28324,2015-12-25 19:08:10,2020-06-20 03:12:25,1,"why !!! b |  | MSNBC Donald Trump has conferred upon himself the title of ""wartime president"" combating corona virus. Lawrence O'Donnell argues that such a label would be appropriate if and only if the president was leading the country's war against the pandemic.",[],[],msnbc donald trump confer upon title wartime president combat corona virus lawrence o'donnell argue label would appropriate president lead country's war pandemic,,[],,,,,,,
4258,faranaaz,"former reporter, recovering early adopter, nascent luddite, intermittent stan. loves libraries, bushwalks and bts. 🇿🇦","sydney, new south wales",2999,2350,15814,2008-04-13 07:46:48,2020-06-22 02:32:31,0,"TikTok users and K-pop stans aside, the issue is that the US is currently being ravaged by Covid-19 and Trump's people insisted on holding an indoor mass rally. Even in countries where Covid is being kept under control, few would be willing to do this (if it were allowed at all). https://t.co/W3jw6mD4Q4",[],[],tiktok user k-pop stans aside issue currently ravage trump's people insist hold indoor mass rally even country covid keep control would willing allow,,"[{'score': 0.716804, 'tone_id': 'analytical', 'tone_name': 'Analytical'}]",,1.0,,,,,
4259,adamyeehaw,transguy he/him/his if you still support jk rowling you own me $5,n.a,650,117,5876,2013-11-09 21:38:33,2020-06-23 01:09:44,40528,The reason why America isn’t recovering from COVID-19 as quickly as other countries is because we are a country that values individualism over collectivism. Nobody here wants to do anything that is a minor inconvenience to them in order to protect their neighbors.,[],[],reason america isn’t recover quickly country country value individualism collectivism nobody want anything minor inconvenience order protect neighbor,,"[{'score': 0.5538, 'tone_id': 'tentative', 'tone_name': 'Tentative'}, {'score': 0.769135, 'tone_id': 'analytical', 'tone_name': 'Analytical'}]",,1.0,,1.0,,,
4260,Bahnessaxo,come what may 🦥♌️🇨🇴💕,n.a,473,80,38989,2017-04-14 04:32:33,2020-06-22 03:21:19,3438,Ngl COVID-19 bout to choke slam the fck out of Florida.,[],[],ngl bout choke slam fck florida,,[],,,,,,,
4261,NanaB_2010,"psych major, behavior analyst #specialolympics  #impeachedforlife #autism #ptsd #bp #advocacy #climate #equality",washington state,1326,680,139073,2009-02-19 01:56:45,2020-06-22 01:39:30,43,"Bloody hell....

What they don’t tell you about surviving COVID-19 https://t.co/XH53GgagSk via @SFGate",[],['@SFGate'],"bloody hell....

what don’t tell survive via","[{'sentence_id': 0, 'text': 'bloody hell....', 'tones': [{'score': 0.647059, 'tone_id': 'sadness', 'tone_name': 'Sadness'}, {'score': 0.857143, 'tone_id': 'anger', 'tone_name': 'Anger'}]}, {'sentence_id': 1, 'text': '', 'tones': []}, {'sentence_id': 2, 'text': 'what don’t tell survive via', 'tones': []}]","[{'score': 0.594518, 'tone_id': 'anger', 'tone_name': 'Anger'}]",,,,,,,1.0
4262,iizWide0pen,"#befairbejustbevegan

“yesterday is gone. tomorrow has not yet come. we have only today. let us begin.”
-mother theresa",n.a,295,209,13441,2020-01-22 00:36:55,2020-06-22 01:38:56,29959,"Trump is cracking jokes in Tulsa about Covid-19, calling it ""kung flu"" which is not only racist but belittles the deaths of 122K Americans and the horrific loss for their families.",[],[],trump crack joke tulsa call kung flu racist belittles death american horrific loss family,,[],,,,,,,
4263,awada,"husband, papa, progressive, veteran, founder @ https://t.co/0wsncerugu","sonoma county, ca",24,26,147,2008-12-02 01:04:27,2020-06-22 03:23:51,0,Herd Immunity for Covid-19 Is 'a Fantasy': Dr. Haseltine https://t.co/RMOiWZuWaj via @YouTube,[],['@YouTube'],herd immunity fantasy dr haseltine via,,[],,,,,,,
4264,wingedsnitches,"slytherclaw, fangirl, book nerd, keeps cats",united states,118,67,1926,2018-10-05 15:10:24,2020-06-23 01:07:42,557,"As Trump pushes claims w/out evidence about voting &amp; fraud, an infectious disease expert's affidavit in an Alabama lawsuit warns COVID-19 presents a real &amp; deadly threat to voters in November. Trump is pursuing reelection at the expense of American lives.
https://t.co/USyYJ6pHPV",[],[],"trump push claim w/out evidence voting amp fraud infectious disease expert's affidavit alabama lawsuit warn present real amp deadly threat voter november trump pursuing reelection expense american lives.
",,"[{'score': 0.512713, 'tone_id': 'fear', 'tone_name': 'Fear'}]",,,,,,1.0,
4265,FlockLesnar,virginia union university alum 🐯,"shark city, va",1650,953,16390,2011-12-19 00:16:26,2020-06-22 03:40:41,42873,"Trump had a bad night in Tulsa. Very low turnout. Even his supporters know that COVID-19 is real and dangerous, and should not be spread at an indoor rally. More importantly, maybe people are catching on that he is a pathological liar and a fraud. Let's keep fighting.",[],[],trump bad night tulsa low turnout even supporter know real dangerous spread indoor rally importantly maybe people catch pathological liar fraud let's keep fighting,,"[{'score': 0.615352, 'tone_id': 'tentative', 'tone_name': 'Tentative'}]",,,,1.0,,,
4266,Evelyn31721,independent voter until 2016.  now republican . pharmacist,a flyover state,1134,956,38249,2014-03-26 00:50:05,2020-06-23 01:08:35,268,What's taking NASCAR so long to look through camera footage to see who supposedly left this noose in Bubba's garage when there's literally nobody going in and out because of covid-19?,[],[],what's take nascar long look camera footage see supposedly leave noose bubba's garage there's literally nobody go,,"[{'score': 0.512529, 'tone_id': 'sadness', 'tone_name': 'Sadness'}]",,,1.0,,,,
4267,GawkingGeek,"instructional protagonist. bisexual and polyamorous geek, with a penchant for academia. (he/him/his)",n.a,204,70,2926,2020-03-30 03:42:56,2020-06-21 02:41:45,499,"“Kellyanne Conway...called reports of a White House official referring to COVID-19 as the ‘kung flu’ virus ‘HIGHLY OFFENSIVE’ ... ‘I'd like to know who they are. But hold on, you can't just say that and not name them. Tell us who it was.’”

March 18, 2020

https://t.co/Zi24Xrqyl1 https://t.co/Dq95baSzT6",[],[],"“kellyanne conway...called report white house official refer ‘kung flu’ virus ‘highly offensive’ ‘i'd like know hold can't say name tell was.’”

march","[{'sentence_id': 0, 'text': ""“kellyanne conway...called report white house official refer ‘kung flu’ virus ‘highly offensive’ ‘i'd like know hold can't say name tell was.’”"", 'tones': [{'score': 0.653099, 'tone_id': 'analytical', 'tone_name': 'Analytical'}]}, {'sentence_id': 1, 'text': '', 'tones': []}, {'sentence_id': 2, 'text': 'march', 'tones': []}]","[{'score': 0.816179, 'tone_id': 'analytical', 'tone_name': 'Analytical'}]",,1.0,,,,,
4268,NGDiPietro,former attorney general of the united states 🌎☕️💻📸📚 parody account,united states,524,61,10213,2019-12-02 14:01:43,2020-06-20 02:04:29,22814,"Trump's rally in Tulsa is indoors, with no social distancing and no mask requirements—all in violation of CDC guidelines. Trump is willing to spread the COVID-19 virus in order to hear some cheers. He is a direct threat to the health of the American people. He must be defeated.",[],[],trump's rally tulsa indoors social distance mask requirements—all violation cdc guideline trump willing spread virus order hear cheer direct threat health american people must defeat,,"[{'score': 0.674728, 'tone_id': 'confident', 'tone_name': 'Confident'}, {'score': 0.642915, 'tone_id': 'analytical', 'tone_name': 'Analytical'}]",,1.0,,,1.0,,
4269,ChiHoneyBear,"@nfl superfan, #niu alum, avid tailgater, 👍 of @girlsinthegame, @noh8campaign, & @youcanplayteam, teacher, 💙activist, & superfan for da #chicagobears","chicagoland, il",2030,946,55289,2012-04-17 23:42:39,2020-06-21 03:14:50,643,"Breaking News: Covid Virus extremely confused at #TrumpRallyFail. ""I'm really disappointed,"" said virus, ""we were going to spread it like warm butter tonight."" Virus adds, ""We'll work with what we got.""",['trumprallyfail'],[],break news covid virus extremely confused i'm really disappoint say virus go spread like warm butter tonight virus add we'll work get,,"[{'score': 0.654326, 'tone_id': 'sadness', 'tone_name': 'Sadness'}]",,,1.0,,,,
4270,GramroRosemary,"conservative, patriot, mother of son with autism, wife. steelers fan. #2nd amendment, god bless america. lds. byu, we got our country back! #maga #kag 💖trump","woodcrest, ca",5001,4163,77581,2012-03-20 18:02:40,2020-06-21 03:29:23,1807,"Why did the Washington Post all of a sudden remove the daily China Virus death tracker from its front page now that COVID deaths are decreasing nationwide?

I guess it just doesn’t fit their narrative anymore.

🤔",[],[],"washington post sudden remove daily china virus death tracker front page covid death decrease nationwide?

i guess doesn’t fit narrative anymore.

🤔","[{'sentence_id': 0, 'text': 'washington post sudden remove daily china virus death tracker front page covid death decrease nationwide?', 'tones': [{'score': 0.511428, 'tone_id': 'sadness', 'tone_name': 'Sadness'}]}, {'sentence_id': 1, 'text': 'i guess doesn’t fit narrative anymore.', 'tones': [{'score': 0.640493, 'tone_id': 'sadness', 'tone_name': 'Sadness'}, {'score': 0.946222, 'tone_id': 'tentative', 'tone_name': 'Tentative'}]}, {'sentence_id': 2, 'text': '🤔', 'tones': []}]","[{'score': 0.630541, 'tone_id': 'sadness', 'tone_name': 'Sadness'}, {'score': 0.893364, 'tone_id': 'tentative', 'tone_name': 'Tentative'}]",,,1.0,1.0,,,
4271,Jacksrule1,married. have jack russell terriers. liberal living in a very red state.,n.a,1947,2557,174556,2012-12-04 00:25:32,2020-06-21 04:07:00,10705,6 members of Trump's Tulsa advance staff have tested positive for COVID-19. Each may have infected hundreds with the virus already.,[],[],member trump's tulsa advance staff test positive may infect hundred virus already,,[],,,,,,,
4272,DJPAIMON,i make music. search dj paimon on all platforms.,"iowa city, ia",1023,4680,831,2009-07-08 18:14:16,2020-06-22 01:19:30,7627,"BREAKING UPDATE:  Florida sets another daily record with 4,671 new reported COVID-19 cases.",[],[],break update florida set another daily record new report case,,"[{'score': 0.579367, 'tone_id': 'analytical', 'tone_name': 'Analytical'}, {'score': 0.704642, 'tone_id': 'confident', 'tone_name': 'Confident'}]",,1.0,,,1.0,,
4273,darealatlnene,n.a,"marietta, ga",924,146,3921,2011-03-19 07:38:14,2020-06-22 03:21:59,8618,"BREAKING UPDATE:  Florida sets another daily record with 4,671 new reported COVID-19 cases.",[],[],break update florida set another daily record new report case,,"[{'score': 0.579367, 'tone_id': 'analytical', 'tone_name': 'Analytical'}, {'score': 0.704642, 'tone_id': 'confident', 'tone_name': 'Confident'}]",,1.0,,,1.0,,
4274,robcam19,there are no pacts between lions and men,"edinburg, tx",194,183,8443,2014-11-08 17:11:57,2020-06-22 01:36:59,19,"Over the weekend, 133 new positive cases of COVID-19 were reported in Hidalgo County and another person died from complications from the disease. The total number of positive cases is now at 1,689.
 
The death involved a Mission man in his 50s with underlying medical conditions. https://t.co/1arjhlFiDS",[],[],"weekend new positive case report hidalgo county another person die complication disease total number positive case 
the death involve mission man underlie medical condition","[{'sentence_id': 0, 'text': 'weekend new positive case report hidalgo county another person die complication disease total number positive case ', 'tones': [{'score': 0.962982, 'tone_id': 'confident', 'tone_name': 'Confident'}, {'score': 0.762356, 'tone_id': 'analytical', 'tone_name': 'Analytical'}]}, {'sentence_id': 1, 'text': 'the death involve mission man underlie medical condition', 'tones': []}]","[{'score': 0.646035, 'tone_id': 'sadness', 'tone_name': 'Sadness'}, {'score': 0.988733, 'tone_id': 'confident', 'tone_name': 'Confident'}, {'score': 0.838983, 'tone_id': 'analytical', 'tone_name': 'Analytical'}]",,1.0,1.0,,1.0,,
4275,CallNotEvilGood,"""woe unto them that call evil good, and good evil; that put darkness for light, and light for darkness ..."" isaiah 5:20 maga. love god, family & country.",n.a,4289,4343,21485,2017-01-27 08:38:08,2020-06-21 02:44:42,5,"""When I banned travel from China due to Corona Virus, Joe Biden called it xenophobia. He doesn't know what the word means."" ~President @realDonaldTrump 

🤣😂😅",[],['@realDonaldTrump'],"ban travel china due corona virus joe biden call xenophobia know word mean president 

🤣","[{'sentence_id': 0, 'text': 'ban travel china due corona virus joe biden call xenophobia know word mean president ', 'tones': [{'score': 0.895415, 'tone_id': 'analytical', 'tone_name': 'Analytical'}]}, {'sentence_id': 1, 'text': '', 'tones': []}, {'sentence_id': 2, 'text': '🤣', 'tones': []}]","[{'score': 0.895415, 'tone_id': 'analytical', 'tone_name': 'Analytical'}]",,1.0,,,,,
4276,Hamiltuckypara,"we investigate the unknown , no smoke or mirrors with us , check the link to our youtube channel below and please subscribe! any business inquiries please dm us","ohio, usa",3828,1041,14532,2013-04-22 00:27:47,2020-06-21 03:11:38,126,More hang American flags than tear them down.There are more good cops than bad. There are more negative tests than positive corona virus tests. More people want to unite than divide. More want to acknowledge injustice than ignore. We are better than some want you to believe.,[],[],hang american flag tear down.there good cop bad negative test positive corona virus test people want unite divide want acknowledge injustice ignore well want believe,"[{'sentence_id': 0, 'text': 'hang american flag tear down.there', 'tones': [{'score': 0.551608, 'tone_id': 'sadness', 'tone_name': 'Sadness'}]}, {'sentence_id': 1, 'text': 'good cop bad negative test positive corona virus test people want unite divide want acknowledge injustice ignore well want believe', 'tones': [{'score': 0.578853, 'tone_id': 'sadness', 'tone_name': 'Sadness'}, {'score': 0.752368, 'tone_id': 'tentative', 'tone_name': 'Tentative'}]}]","[{'score': 0.648089, 'tone_id': 'sadness', 'tone_name': 'Sadness'}, {'score': 0.940365, 'tone_id': 'tentative', 'tone_name': 'Tentative'}]",,,1.0,1.0,,,
4277,tallmantim,keen cyclist working in it,melbourne australia,571,129,2299,2010-01-27 07:19:17,2020-06-22 03:20:52,154,BLM 👏 PROTESTS 👏 DIDN’T 👏 CAUSE 👏 MELBOURNE’S 👏 COVID-19 👏SPIKE 👏,[],[],blm protest didn’t cause melbourne’s spike,,"[{'score': 0.762356, 'tone_id': 'analytical', 'tone_name': 'Analytical'}]",,1.0,,,,,
4278,Pizza7776,pooop,yo mama,30,5,9,2016-05-07 21:01:05,2020-06-21 04:22:20,0,Bruh if you got the Corona virus just… don’t,[],[],bruh get corona virus just… don’t,,"[{'score': 0.946222, 'tone_id': 'tentative', 'tone_name': 'Tentative'}]",,,,1.0,,,
