index,username,acctdesc,location,following,followers,totaltweets,usercreatedts,tweetcreatedts,retweetcount,text,hashtags,mentioned_users,cleaned_text,sentences_tone,document_tones,joy,analytical,sadness,tentative,confident,fear,anger
4468,KFMVIEWS,old hack., new south wales,2320,1045,38766,2009-06-21 02:45:17,2020-06-21 03:40:38,155,We have been told incessantly that no need to worry about Covid and schools. Take a look at recent resurgence of virus in Israel,[],[],tell incessantly need worry covid school take look recent resurgence virus israel,,"[{'score': 0.540441, 'tone_id': 'fear', 'tone_name': 'Fear'}]",,,,,,1.0,
4469,DevarVari,n.a,earth  ,456,209,65648,2017-02-14 20:49:23,2020-06-22 03:42:02,16,THE REAL LOOTING: @stevenmnuchin1 Blocked Oversight of #COVID19 Rescue Funds For Months. READ: https://t.co/2MV6DgdqYX #SmartDissent #Corruption #CaresAct #PPPloans #COVID https://t.co/yN85noahTH,['covid19'],['@stevenmnuchin1'],real looting block oversight rescue fund month read,,"[{'score': 0.803567, 'tone_id': 'analytical', 'tone_name': 'Analytical'}, {'score': 0.704642, 'tone_id': 'confident', 'tone_name': 'Confident'}]",,1.0,,,1.0,,
4470,michelleboggs18,n.a,n.a,49,25,1418,2018-02-20 16:00:52,2020-06-21 02:25:56,755,"Why did the Washington Post all of a sudden remove the daily China Virus death tracker from its front page now that COVID deaths are decreasing nationwide?

I guess it just doesn’t fit their narrative anymore.

🤔",[],[],"washington post sudden remove daily china virus death tracker front page covid death decrease nationwide?

i guess doesn’t fit narrative anymore.

🤔","[{'sentence_id': 0, 'text': 'washington post sudden remove daily china virus death tracker front page covid death decrease nationwide?', 'tones': [{'score': 0.511428, 'tone_id': 'sadness', 'tone_name': 'Sadness'}]}, {'sentence_id': 1, 'text': 'i guess doesn’t fit narrative anymore.', 'tones': [{'score': 0.640493, 'tone_id': 'sadness', 'tone_name': 'Sadness'}, {'score': 0.946222, 'tone_id': 'tentative', 'tone_name': 'Tentative'}]}, {'sentence_id': 2, 'text': '🤔', 'tones': []}]","[{'score': 0.630541, 'tone_id': 'sadness', 'tone_name': 'Sadness'}, {'score': 0.893364, 'tone_id': 'tentative', 'tone_name': 'Tentative'}]",,,1.0,1.0,,,
4471,Iunasolis,"laura 🇻🇪  || she/her || 20 y/o game design major || 

art insta: @laurareyesart ||

icon is a picrew from @poika_",verona blacke @ cactuar,527,181,16544,2015-12-21 15:03:13,2020-06-22 02:13:23,24541,Lack of taste is a symptom of covid-19 https://t.co/o2txxNFLn3,[],[],lack taste symptom,,"[{'score': 0.955445, 'tone_id': 'analytical', 'tone_name': 'Analytical'}]",,1.0,,,,,
4472,jayy_veraa1,n.a,"yuma, az",181,200,7111,2014-04-10 02:34:24,2020-06-22 03:41:59,42838,"Trump had a bad night in Tulsa. Very low turnout. Even his supporters know that COVID-19 is real and dangerous, and should not be spread at an indoor rally. More importantly, maybe people are catching on that he is a pathological liar and a fraud. Let's keep fighting.",[],[],trump bad night tulsa low turnout even supporter know real dangerous spread indoor rally importantly maybe people catch pathological liar fraud let's keep fighting,,"[{'score': 0.615352, 'tone_id': 'tentative', 'tone_name': 'Tentative'}]",,,,1.0,,,
4473,SweetBiswas12,n.a,n.a,643,78,7650,2020-04-26 04:34:26,2020-06-21 04:08:00,427,"“Because of the Chinese virus what happened about 3 months ago—it looked like we were in big trouble, and we were and I got it back together.” Trump at Tulsa rally. American media most upset with term 'Chinese virus', calling DT a racist. Also shows the disconnect b/w media &amp; ppl",[],[],“because chinese virus happen month ago—it look like big trouble get back together.” trump tulsa rally american medium upset term chinese virus call dt racist also show disconnect b/w medium amp ppl,"[{'sentence_id': 0, 'text': '“because chinese virus happen month ago—it look like big trouble get back together.”', 'tones': [{'score': 0.560098, 'tone_id': 'analytical', 'tone_name': 'Analytical'}]}, {'sentence_id': 1, 'text': 'trump tulsa rally american medium upset term chinese virus call dt racist also show disconnect b/w medium amp ppl', 'tones': []}]","[{'score': 0.50589, 'tone_id': 'tentative', 'tone_name': 'Tentative'}]",,,,1.0,,,
4474,spauldingshowal,"#maga, all posts are made by my own  views through scientific facts, and religious beliefs "" ... ""this includes views on behalf of our government",n.a,7695,7120,158571,2012-12-12 03:37:53,2020-06-22 01:19:10,33,"If the flu [influenza] is more deadly among the elderly [known] HOW IS IT POSSIBLE SELECT [D] GOVERNORS THOUGHT IT WAS 'SAFE' TO PUSH COVID-19 POSITIVE ELDERLY PATIENTS BACK INTO NURSING HOMES [HOT ZONES]?

#qanon https://t.co/W4BnR2DX4t",[],[],"flu influenza deadly among elderly know possible select governor think safe push positive elderly patient back nurse home hot zones]?

",,"[{'score': 0.827997, 'tone_id': 'analytical', 'tone_name': 'Analytical'}]",,1.0,,,,,
4475,multitabs_baker,"doesn't keep track of social media very well, but i'm trying. and i try to art! and i dont know dem letters",n.a,62,35,1576,2017-05-22 02:39:44,2020-06-22 03:42:27,4317,"No COVID-19 surge if only the Duterte administration truly cared about saving lives, not saving face. #MassTestingNotMassArrests #JunkTerrorBill https://t.co/z1YxhLkzin",[],[],surge duterte administration truly care save life save face,,"[{'score': 0.553664, 'tone_id': 'joy', 'tone_name': 'Joy'}, {'score': 0.901894, 'tone_id': 'analytical', 'tone_name': 'Analytical'}, {'score': 0.874372, 'tone_id': 'confident', 'tone_name': 'Confident'}]",1.0,1.0,,,1.0,,
4476,freddysneezy,n.a,n.a,631,67,2603,2009-07-12 07:15:08,2020-06-23 01:08:06,7145,"A megachurch is hosting Trump's rally on Tuesday in Phoenix. These two con-men falsely claim they've installed a system which kills 99.9% of COVID-19. 

Arizona's Coronavirus numbers are surging. Madness...https://t.co/6mgM8BLhO9",[],[],"megachurch host trump's rally tuesday phoenix two con-men falsely claim they've instal system kill 

arizona's coronavirus number surge madness","[{'sentence_id': 0, 'text': ""megachurch host trump's rally tuesday phoenix two con-men falsely claim they've instal system kill "", 'tones': [{'score': 0.568169, 'tone_id': 'sadness', 'tone_name': 'Sadness'}]}, {'sentence_id': 1, 'text': '', 'tones': []}, {'sentence_id': 2, 'text': ""arizona's coronavirus number surge madness"", 'tones': []}]",[],,,,,,,
4477,Mishalviews,"‏‏‏‏‏‏الحمداللہ
اپنی اولاد کو فخر سے بتاؤں گا کہ جب نوازشریف اس ملک میں جمہوریت کی بقاء کے لئےلڑائی لڑ رہا تھا تب میں بھی اسکے عظیم قافلے کا ایک معمولی سا سپاہی","islamabad, pakistan",621,781,51470,2012-07-12 19:22:55,2020-06-21 02:34:07,80,"For the attention of worthy Minister for Climate Change, may God have mercy on us:

COVID 19 stands for CO (Corona) VI (Virus) D (Disease) and 19 stands for 2019, the year when it first hit. Please explain the 19 points if you can
@ZartajGWazir https://t.co/g4nPJYzLli",[],['@ZartajGWazir'],"attention worthy minister climate change may god mercy us:

covid stand co corona vi virus disease stand year first hit please explain point can
","[{'sentence_id': 0, 'text': 'attention worthy minister climate change may god mercy us:', 'tones': [{'score': 0.724236, 'tone_id': 'analytical', 'tone_name': 'Analytical'}, {'score': 0.856622, 'tone_id': 'tentative', 'tone_name': 'Tentative'}]}, {'sentence_id': 1, 'text': '', 'tones': []}, {'sentence_id': 2, 'text': 'covid stand co corona vi virus disease stand year first hit please explain point can', 'tones': [{'score': 0.532616, 'tone_id': 'analytical', 'tone_name': 'Analytical'}]}]","[{'score': 0.802429, 'tone_id': 'analytical', 'tone_name': 'Analytical'}, {'score': 0.865388, 'tone_id': 'tentative', 'tone_name': 'Tentative'}]",,1.0,,1.0,,,
4478,AmberDirks,"wv vengeance co-oc/dc coach 🏈

wife/mom💍👫professional singer, song writer🎙🎼, billboard recording artist🎧 and always keeping it 💯",worldwide,722,459,6069,2009-07-29 15:16:09,2020-06-23 01:26:44,0,"with their studies and sports that they're trying to go to the next level with in college, because people are in denial of all the deaths that were brought on by COVID-19 and continue to selflessly defy the rules. Now our youths future is in jeopardy.

I'm #TIRED!! Of what 2/3",['tired'],[],"study sport they're try go next level college people denial death bring continue selflessly defy rule youth future jeopardy.

i'm","[{'sentence_id': 0, 'text': ""study sport they're try go next level college people denial death bring continue selflessly defy rule youth future jeopardy."", 'tones': [{'score': 0.59917, 'tone_id': 'sadness', 'tone_name': 'Sadness'}]}, {'sentence_id': 1, 'text': ""i'm"", 'tones': []}]","[{'score': 0.59917, 'tone_id': 'sadness', 'tone_name': 'Sadness'}, {'score': 0.655446, 'tone_id': 'tentative', 'tone_name': 'Tentative'}]",,,1.0,1.0,,,
4479,Nojo13,managing partner best western plus service inn & suites,n.a,49,118,5452,2012-02-08 21:41:36,2020-06-20 02:02:55,22825,"Trump's rally in Tulsa is indoors, with no social distancing and no mask requirements—all in violation of CDC guidelines. Trump is willing to spread the COVID-19 virus in order to hear some cheers. He is a direct threat to the health of the American people. He must be defeated.",[],[],trump's rally tulsa indoors social distance mask requirements—all violation cdc guideline trump willing spread virus order hear cheer direct threat health american people must defeat,,"[{'score': 0.642915, 'tone_id': 'analytical', 'tone_name': 'Analytical'}, {'score': 0.674728, 'tone_id': 'confident', 'tone_name': 'Confident'}]",,1.0,,,1.0,,
4480,PhadnisRajesh,"a family man, telco professional, eternal student of data science",n.a,106,67,354,2014-01-08 09:06:22,2020-06-23 01:28:30,7,"An overview of our COVID-19 initiatives as of June 21st 2020.
#CoronaHaaregaIndiaJeetega #TogetherWeWill https://t.co/t1mOr2a2eu","['coronahaaregaindiajeetega', 'togetherwewill']",[],overview initiative june,,[],,,,,,,
4481,Shoq,i try to see and say things that need seeing and saying. • i believe in the semantic web. i just don't know what that means.,south f-ing florida,2391,25007,646837,2007-08-25 21:43:05,2020-06-22 01:21:51,45,"Chris Hayes on U.S. COVID-19 response: 

“The last refuge for comparison…was Europe. And it was a way for making ourselves feel better about how we were dealing with the virus. But now that is clearly gone. Europe has suppressed the virus and we have not.”https://t.co/PvkuxeRehq",[],[],"chris hayes u.s response 

“the last refuge comparison…was europe way make feel well deal virus clearly go europe suppress virus not.”","[{'sentence_id': 0, 'text': 'chris hayes u.s response ', 'tones': []}, {'sentence_id': 1, 'text': '', 'tones': []}, {'sentence_id': 2, 'text': '“the last refuge comparison…was europe way make feel well deal virus clearly go europe suppress virus not.”', 'tones': [{'score': 0.558406, 'tone_id': 'sadness', 'tone_name': 'Sadness'}, {'score': 0.884998, 'tone_id': 'analytical', 'tone_name': 'Analytical'}]}]","[{'score': 0.553139, 'tone_id': 'sadness', 'tone_name': 'Sadness'}, {'score': 0.89164, 'tone_id': 'analytical', 'tone_name': 'Analytical'}, {'score': 0.79901, 'tone_id': 'confident', 'tone_name': 'Confident'}]",,1.0,1.0,,1.0,,
4482,aspeltuo8,be a human. in god we trust! glory to my lord.,n.a,635,321,34355,2017-04-25 10:33:58,2020-06-21 03:14:27,1689,"Why did the Washington Post all of a sudden remove the daily China Virus death tracker from its front page now that COVID deaths are decreasing nationwide?

I guess it just doesn’t fit their narrative anymore.

🤔",[],[],"washington post sudden remove daily china virus death tracker front page covid death decrease nationwide?

i guess doesn’t fit narrative anymore.

🤔","[{'sentence_id': 0, 'text': 'washington post sudden remove daily china virus death tracker front page covid death decrease nationwide?', 'tones': [{'score': 0.511428, 'tone_id': 'sadness', 'tone_name': 'Sadness'}]}, {'sentence_id': 1, 'text': 'i guess doesn’t fit narrative anymore.', 'tones': [{'score': 0.640493, 'tone_id': 'sadness', 'tone_name': 'Sadness'}, {'score': 0.946222, 'tone_id': 'tentative', 'tone_name': 'Tentative'}]}, {'sentence_id': 2, 'text': '🤔', 'tones': []}]","[{'score': 0.630541, 'tone_id': 'sadness', 'tone_name': 'Sadness'}, {'score': 0.893364, 'tone_id': 'tentative', 'tone_name': 'Tentative'}]",,,1.0,1.0,,,
4483,ccbrunn,"show me your kitties 🐱🏋🏼‍♀️🏳️‍🌈🧘🏼‍♀️| ♊️☀️, ♌️⬆️, ♎️🌙","columbus, oh",179,283,21601,2009-12-19 22:42:49,2020-06-20 01:55:08,22885,"Trump's rally in Tulsa is indoors, with no social distancing and no mask requirements—all in violation of CDC guidelines. Trump is willing to spread the COVID-19 virus in order to hear some cheers. He is a direct threat to the health of the American people. He must be defeated.",[],[],trump's rally tulsa indoors social distance mask requirements—all violation cdc guideline trump willing spread virus order hear cheer direct threat health american people must defeat,,"[{'score': 0.674728, 'tone_id': 'confident', 'tone_name': 'Confident'}, {'score': 0.642915, 'tone_id': 'analytical', 'tone_name': 'Analytical'}]",,1.0,,,1.0,,
4484,dlrlv,"girlfriend, all around stay @ home mom.....concerned about our country! how can people want to destroy america??? #maga #kag #fbts",las vegas,2499,4192,109656,2009-02-20 19:04:06,2020-06-22 03:22:15,67,"While most non-violent inmates have been transferred from prison to home confinement, Roger Stone is being sent to a COVID-19 infested prison in 10 days. 

It’s time to #FreeRogerStone 

https://t.co/NCPVvBbINg",[],[],"non-violent inmate transfer prison home confinement roger stone send infested prison day 

it’s time 

","[{'sentence_id': 0, 'text': 'non-violent inmate transfer prison home confinement roger stone send infested prison day ', 'tones': [{'score': 0.535939, 'tone_id': 'sadness', 'tone_name': 'Sadness'}, {'score': 0.672469, 'tone_id': 'analytical', 'tone_name': 'Analytical'}]}, {'sentence_id': 1, 'text': '', 'tones': []}, {'sentence_id': 2, 'text': 'it’s time', 'tones': []}]","[{'score': 0.563512, 'tone_id': 'sadness', 'tone_name': 'Sadness'}, {'score': 0.797642, 'tone_id': 'analytical', 'tone_name': 'Analytical'}]",,1.0,1.0,,,,
4485,gritchkittie,"washington state conservative, i know hard to believe!",n.a,157,952,166975,2009-03-17 00:36:32,2020-06-22 02:10:26,289,"Gov Whitmer declined nursing home leader's idea to put COVID-19 patients in vacant centers. Three days after the confirmation of first COVID-19 case, the state's nursing home association leader sent a letter to Whitmer's that empty facilities should be used as quarantine centers https://t.co/Tepz7kDSUi",[],[],gov whitmer decline nursing home leader's idea put patient vacant center three day confirmation first case state's nursing home association leader send letter whitmer's empty facility use quarantine center,,"[{'score': 0.893507, 'tone_id': 'analytical', 'tone_name': 'Analytical'}]",,1.0,,,,,
4486,kenrosenel,n.a,n.a,194,249,6708,2014-10-14 20:13:28,2020-06-21 04:21:21,10695,6 members of Trump's Tulsa advance staff have tested positive for COVID-19. Each may have infected hundreds with the virus already.,[],[],member trump's tulsa advance staff test positive may infect hundred virus already,,[],,,,,,,
4487,djfamili26,efectivo a la protección desarrollo defensa lucha por la vida  la libertad y orden. valores principios  constitucionales americanos🗽🗽🗽#maga🗽🗽🗽🇺🇸🇺🇸🇺🇸,colombia,917,918,73954,2013-03-19 16:40:41,2020-06-21 02:37:35,1253,"Why did the Washington Post all of a sudden remove the daily China Virus death tracker from its front page now that COVID deaths are decreasing nationwide?

I guess it just doesn’t fit their narrative anymore.

🤔",[],[],"washington post sudden remove daily china virus death tracker front page covid death decrease nationwide?

i guess doesn’t fit narrative anymore.

🤔","[{'sentence_id': 0, 'text': 'washington post sudden remove daily china virus death tracker front page covid death decrease nationwide?', 'tones': [{'score': 0.511428, 'tone_id': 'sadness', 'tone_name': 'Sadness'}]}, {'sentence_id': 1, 'text': 'i guess doesn’t fit narrative anymore.', 'tones': [{'score': 0.640493, 'tone_id': 'sadness', 'tone_name': 'Sadness'}, {'score': 0.946222, 'tone_id': 'tentative', 'tone_name': 'Tentative'}]}, {'sentence_id': 2, 'text': '🤔', 'tones': []}]","[{'score': 0.630541, 'tone_id': 'sadness', 'tone_name': 'Sadness'}, {'score': 0.893364, 'tone_id': 'tentative', 'tone_name': 'Tentative'}]",,,1.0,1.0,,,
4488,josephpipoli,the only easy day was yesterday | kδρ esu '18. old bridge nj,n.a,790,573,9380,2010-03-30 14:16:40,2020-06-20 01:52:45,22902,"Trump's rally in Tulsa is indoors, with no social distancing and no mask requirements—all in violation of CDC guidelines. Trump is willing to spread the COVID-19 virus in order to hear some cheers. He is a direct threat to the health of the American people. He must be defeated.",[],[],trump's rally tulsa indoors social distance mask requirements—all violation cdc guideline trump willing spread virus order hear cheer direct threat health american people must defeat,,"[{'score': 0.674728, 'tone_id': 'confident', 'tone_name': 'Confident'}, {'score': 0.642915, 'tone_id': 'analytical', 'tone_name': 'Analytical'}]",,1.0,,,1.0,,
4489,chludzin007,member of the resistance * democrat * it tech * photographer * husband * dad * papa * yankee fan * seawolves fan,n.a,181,56,5234,2013-12-19 20:25:02,2020-06-20 02:56:11,25291,"Trump's rally in Tulsa is indoors, with no social distancing and no mask requirements—all in violation of CDC guidelines. Trump is willing to spread the COVID-19 virus in order to hear some cheers. He is a direct threat to the health of the American people. He must be defeated.",[],[],trump's rally tulsa indoors social distance mask requirements—all violation cdc guideline trump willing spread virus order hear cheer direct threat health american people must defeat,,"[{'score': 0.674728, 'tone_id': 'confident', 'tone_name': 'Confident'}, {'score': 0.642915, 'tone_id': 'analytical', 'tone_name': 'Analytical'}]",,1.0,,,1.0,,
4490,DRothsteen,n.a,"augusta, ga",462,102,21971,2019-03-17 17:48:46,2020-06-22 01:22:08,7613,"BREAKING UPDATE:  Florida sets another daily record with 4,671 new reported COVID-19 cases.",[],[],break update florida set another daily record new report case,,"[{'score': 0.579367, 'tone_id': 'analytical', 'tone_name': 'Analytical'}, {'score': 0.704642, 'tone_id': 'confident', 'tone_name': 'Confident'}]",,1.0,,,1.0,,
4491,QveenxxBee,local angel ☆ kαθ ¨̮ | 94:5-6 #blm,texas,636,1099,32483,2015-03-14 00:17:05,2020-06-23 01:09:21,40687,The reason why America isn’t recovering from COVID-19 as quickly as other countries is because we are a country that values individualism over collectivism. Nobody here wants to do anything that is a minor inconvenience to them in order to protect their neighbors.,[],[],reason america isn’t recover quickly country country value individualism collectivism nobody want anything minor inconvenience order protect neighbor,,"[{'score': 0.5538, 'tone_id': 'tentative', 'tone_name': 'Tentative'}, {'score': 0.769135, 'tone_id': 'analytical', 'tone_name': 'Analytical'}]",,1.0,,1.0,,,
4492,emptypocketfarm,n.a,n.a,264,42,14176,2010-12-08 16:06:07,2020-06-20 02:56:18,113,"@greggutfeld @JesseBWatters @DanaPerino The number to follow is deaths, not cases...and deaths continue to trend downward... if deaths are trending down and cases up, it means the virus isn't as lethal as we were led to believe.
https://t.co/0iudQX77Ub",[],"['@greggutfeld', '@JesseBWatters', '@DanaPerino']","number follow death cases...and death continue trend downward death trend case mean virus lethal lead believe.
",,"[{'score': 0.622857, 'tone_id': 'sadness', 'tone_name': 'Sadness'}, {'score': 0.855572, 'tone_id': 'analytical', 'tone_name': 'Analytical'}, {'score': 0.513082, 'tone_id': 'tentative', 'tone_name': 'Tentative'}]",,1.0,1.0,1.0,,,
4493,DCRHAAFMTP,"90% pharmacist (hell, maybe even 95%!).
perpetual acne sufferer.
loves calvin klein underwear and la roche-posay.",มลรัฐคอนแค่น ประเทศสารขัณฑ์,202,1055,283486,2012-08-26 11:32:41,2020-06-20 02:02:42,6,"Brazil passes 1 million coronavirus cases, Zimbabwe minister arrested over virus scandal and Costa Rica delays reopening of its economy - Follow our live blog for all the latest updates on the COVID-19 pandemic https://t.co/rGKpwdvn43",[],[],brazil pass million coronavirus case zimbabwe minister arrest virus scandal costa rica delay reopen economy follow live blog late update pandemic,,"[{'score': 0.555068, 'tone_id': 'sadness', 'tone_name': 'Sadness'}]",,,1.0,,,,
4494,yurarinn0517,"音楽f🎹大好きで、フィギュアスケートの羽生結弦選手🐯💖を応援しています。はにゅうさんの右足君と左足君に感謝ﾃﾞｽﾝ(*μ_μ)♪ゆづ小町さん全力応援📣ちう💫
いっつも、ありがとうございますﾆｬﾝ💜❤💚💝",日本 埼玉,1194,628,67573,2015-12-10 14:19:08,2020-06-22 03:20:10,1,"Hello! I hope every follower is fine under our difficult days with covid-19. My new album is released: Estampes by Debussy, 3 Romances by Schumann, etc. Please enjoy! https://t.co/miGDTU0xsT #NowPlaying",[],[],hello hope every follower fine difficult day new album release estampes debussy romance schumann etc please enjoy,,"[{'score': 0.728631, 'tone_id': 'joy', 'tone_name': 'Joy'}]",1.0,,,,,,
4495,billcap,"amazonian, ex-microsoft, avid reader, top 1% amazon reviewer, sports fan & soccer player, nyt crossword puzzle fanatic,views my own, rts not an endorsement","bellevue, wa",3178,833,28538,2008-03-19 05:39:13,2020-06-21 02:36:16,42509,"Trump's rally in Tulsa is indoors, with no social distancing and no mask requirements—all in violation of CDC guidelines. Trump is willing to spread the COVID-19 virus in order to hear some cheers. He is a direct threat to the health of the American people. He must be defeated.",[],[],trump's rally tulsa indoors social distance mask requirements—all violation cdc guideline trump willing spread virus order hear cheer direct threat health american people must defeat,,"[{'score': 0.674728, 'tone_id': 'confident', 'tone_name': 'Confident'}, {'score': 0.642915, 'tone_id': 'analytical', 'tone_name': 'Analytical'}]",,1.0,,,1.0,,
4496,ProthomAlo,"the daily prothom alo, worlds' number 1 bengali news portal. follow us for real time news & updates at http://t.co/c504mszq0z #prothomalo","dhaka, bangladesh",364,1606200,149482,2010-11-08 13:46:28,2020-06-22 03:41:33,1,WHO reports record daily increase in COVID-19 cases https://t.co/G8uOwY3HxA,[],[],report record daily increase case,,"[{'score': 0.687768, 'tone_id': 'analytical', 'tone_name': 'Analytical'}, {'score': 0.898327, 'tone_id': 'confident', 'tone_name': 'Confident'}]",,1.0,,,1.0,,
4497,kvswamp,n.a,n.a,994,332,5740,2010-08-15 02:54:14,2020-06-21 02:21:50,0,"@faley1 @australianpatr5 Yep, same here it’s a windfall for the health care facilities to have it declared Chinese virus death",[],"['@faley1', '@australianpatr5']",yep it’s windfall health care facility declare chinese virus death,,"[{'score': 0.882284, 'tone_id': 'analytical', 'tone_name': 'Analytical'}]",,1.0,,,,,
4498,john89968302,"used to be a football fan, waiting on baseball old and definitely not here for dating!!!i have watched wrestling for 40yrs and i am semi retired",the good ol usa,127,360,27046,2019-01-31 13:03:23,2020-06-22 02:14:18,22,"How is it possible select [D] governors thought it was 'safe' to push COVID-19 positive elderly patients back into nursing homes [hot zones]?
Q
 https://t.co/dGZXyW4wjH",[],[],"possible select governor think safe push positive elderly patient back nurse home hot zones]?
q
","[{'sentence_id': 0, 'text': 'possible select governor think safe push positive elderly patient back nurse home hot zones]?', 'tones': [{'score': 0.821444, 'tone_id': 'analytical', 'tone_name': 'Analytical'}]}, {'sentence_id': 1, 'text': 'q', 'tones': []}]","[{'score': 0.932512, 'tone_id': 'analytical', 'tone_name': 'Analytical'}]",,1.0,,,,,
4499,nighthawk006,#kag #trump2020 “truth is a force of nature” - potus #45 #3stars4genflynn #freerogerstone 🇳🇿🇺🇸🇮🇱 blocked by krassenstein bros & the palmer report 😎 @oann,n.a,5000,2866,14357,2008-09-13 10:28:59,2020-06-21 02:46:49,0,@weijia As usual you’ve miss reported. He didn’t refer to the Chinese virus by that name he was talking about the different names it has and where it originated from (Chy naa). 😎 #CorruptNews #FakeNews #ChineseVirus #KungFlu  #4thDimensionChess #KarenTriggeredAgain,"['corruptnews', 'fakenews', 'chinesevirus', 'kungflu', '4thdimensionchess', 'karentriggeredagain']",['@weijia'],usual you’ve miss report didn’t refer chinese virus name talk different name originate chy naa,,"[{'score': 0.532616, 'tone_id': 'analytical', 'tone_name': 'Analytical'}, {'score': 0.554859, 'tone_id': 'tentative', 'tone_name': 'Tentative'}]",,1.0,,1.0,,,
