index,username,acctdesc,location,following,followers,totaltweets,usercreatedts,tweetcreatedts,retweetcount,text,hashtags,mentioned_users,cleaned_text,sentences_tone,document_tones,joy,analytical,sadness,tentative,confident,fear,anger
4733,LadyKayHersh,"she/her, 27, a gay trans lady",n.a,235,118,45929,2015-01-25 08:15:24,2020-06-22 03:19:21,151,"A couple of reminders:

- we're still in a global pandemic
- people are still dying
- healthy young people with no ""underlying health issues"" have died from covid
- even if you're fine, you might still spread the virus
- wear a mask in public
- wash/sanitise your hands",[],[],"couple reminders:

 we're still global pandemic
 people still dying
 healthy young people underlie health issue die covid
 even fine might still spread virus
 wear mask public
 wash/sanitise hand","[{'sentence_id': 0, 'text': 'couple reminders:', 'tones': []}, {'sentence_id': 1, 'text': '', 'tones': []}, {'sentence_id': 2, 'text': "" we're still global pandemic"", 'tones': []}, {'sentence_id': 3, 'text': ' people still dying', 'tones': []}, {'sentence_id': 4, 'text': ' healthy young people underlie health issue die covid', 'tones': [{'score': 0.68192, 'tone_id': 'sadness', 'tone_name': 'Sadness'}, {'score': 0.762356, 'tone_id': 'analytical', 'tone_name': 'Analytical'}]}, {'sentence_id': 5, 'text': ' even fine might still spread virus', 'tones': [{'score': 0.994446, 'tone_id': 'tentative', 'tone_name': 'Tentative'}]}, {'sentence_id': 6, 'text': ' wear mask public', 'tones': []}, {'sentence_id': 7, 'text': ' wash/sanitise hand', 'tones': []}]","[{'score': 0.948691, 'tone_id': 'tentative', 'tone_name': 'Tentative'}]",,,,1.0,,,
4734,sippinJEN_,catch up to my campaign | vcu alumnus,wherever the wind takes me ,2230,1989,176880,2011-10-12 21:47:17,2020-06-22 03:22:32,0,"I just wanna say that COVID-19 is ass and has ruined mad shit for me, but everything will be fine.",[],[],wanna say as ruin mad shit everything fine,,"[{'score': 0.803837, 'tone_id': 'anger', 'tone_name': 'Anger'}]",,,,,,,1.0
4735,HonkerTheSkunk,header photo by @master0fhyrule. biden/lujan grisham 2020. sign up for #league46: https://t.co/bczf7uje56 #blacklivesmatter,vultureville,789,266,46128,2019-09-30 01:37:23,2020-06-22 03:37:56,25,"“...some unknown number attended parties last weekend with players who later tested positive for COVID-19. In less than one week, the program went from zero to two to eight to 14 confirmed positives.”
This is going to be incredibly hard for college programs to control. https://t.co/pBPngNB4St",[],[],"“...some unknown number attend party last weekend player later test positive less one week program go zero two eight confirm positives.”
this go incredibly hard college program control","[{'sentence_id': 0, 'text': '“...some unknown number attend party last weekend player later test positive less one week program go zero two eight confirm positives.”', 'tones': [{'score': 0.574443, 'tone_id': 'joy', 'tone_name': 'Joy'}, {'score': 0.696092, 'tone_id': 'analytical', 'tone_name': 'Analytical'}]}, {'sentence_id': 1, 'text': 'this go incredibly hard college program control', 'tones': [{'score': 0.652699, 'tone_id': 'sadness', 'tone_name': 'Sadness'}, {'score': 0.751512, 'tone_id': 'confident', 'tone_name': 'Confident'}]}]","[{'score': 0.774302, 'tone_id': 'analytical', 'tone_name': 'Analytical'}, {'score': 0.752665, 'tone_id': 'confident', 'tone_name': 'Confident'}]",,1.0,,,1.0,,
4736,e1234567890_,angel investor. rt:tweets=my own views. snarky remarks https://t.co/mrgh3j28oj,la & galaxy far far away,3764,2464,111118,2014-08-27 05:09:21,2020-06-23 01:27:33,12,"L.A. County public health Director Dr. Barbara Ferrer today announced 2,571 newly confirmed cases of COVID-19 and 18 additional virus-related deaths, bringing countywide totals to 85,942 cases and 3,137 deaths https://t.co/sFJktgGSvc",[],[],l.a county public health director dr barbara ferrer today announce newly confirm case additional virus-related death bring countywide total case death,,"[{'score': 0.788547, 'tone_id': 'analytical', 'tone_name': 'Analytical'}]",,1.0,,,,,
4737,sar_oso,"if you're  here to make excuses for cops just move on along!
fuck you're kkkristian religion #medicare4all #science no magats!
this angry mexican hates trump!","sacramento, ca",14000,13105,562059,2015-06-23 02:55:54,2020-06-22 01:18:35,712,"Florida is a COVID-19 apocalypse compliments of science-denier, idiot, and @realDonaldTrump sycophant, @GovRonDeSantis. Nearly every day in June has set a new daily record. Perhaps opening the restaurants, bars and beaches weeks ago was a horrible idea.",[],"['@realDonaldTrump', '@GovRonDeSantis.']",florida apocalypse compliment science-denier idiot sycophant nearly every day june set new daily record perhaps open restaurant bar beach week ago horrible idea,,[],,,,,,,
4738,sujajackson,"#maga trump is my president, #kag2020
god, family, guns. 
conservative
from oak cliff texas.
live in dallas.
married.
 i have a yorkie named magnum.","dallas, tx",1817,1277,17554,2016-04-15 22:13:12,2020-06-21 02:39:23,0,@australianpatr5 Yes. He's passed away from the Chinese virus.,[],['@australianpatr5'],yes he's pass away chinese virus,,"[{'score': 0.864888, 'tone_id': 'sadness', 'tone_name': 'Sadness'}]",,,1.0,,,,
4739,HectorSolon,it is a crime for a citizen to shrink from service to one's society. #cnp & #alecexposed #devosexposed #tbats #flintwatercrisis #savemi #savecitizengovt #resist,n.a,985,1580,62220,2012-01-19 01:49:53,2020-06-23 01:07:43,12,Gov. Whitmer “would think very seriously about” trying to stop President Donald Trump from holding a rally in Michigan during the COVID-19 pandemic. https://t.co/0VLfd6iHbV,[],[],gov whitmer “would think seriously about” try stop president donald trump hold rally michigan pandemic,,"[{'score': 0.532616, 'tone_id': 'analytical', 'tone_name': 'Analytical'}]",,1.0,,,,,
4740,tharry,"nurse #nutrition #exercise, #wellbeing #womenshealth #intersectionalfeminism #sexed she/her ed =🗝 #nursetwitter need 2 know 2 grow. all views expressed my own.","kildare, ireland",3100,2494,23886,2009-02-24 15:29:00,2020-06-22 02:10:56,18,"Anyone living with affected by or working in HIV care is invited to join an online conversation on Tuesday about the impact of COVID-19 on HIV care. Help shape our future research. 

Tues 23 June, 5pm

Hosted by our @Imperial_PERC and @Positively_UK.
https://t.co/4D2j3syCrs",[],"['@Imperial_PERC', '@Positively_UK.']","anyone living affect work hiv care invite join online conversation tuesday impact hiv care help shape future research 

tues june","[{'sentence_id': 0, 'text': 'anyone living affect work hiv care invite join online conversation tuesday impact hiv care help shape future research ', 'tones': [{'score': 0.5538, 'tone_id': 'tentative', 'tone_name': 'Tentative'}]}, {'sentence_id': 1, 'text': '', 'tones': []}, {'sentence_id': 2, 'text': 'tues june', 'tones': []}]","[{'score': 0.902459, 'tone_id': 'tentative', 'tone_name': 'Tentative'}]",,,,1.0,,,
4741,wtf4174,"dad husband gamer
e pluribus unum
vote them out
yes i retweet alot
bradyless and lovin it",massachusetts,746,130,1403,2020-05-08 18:51:42,2020-06-22 01:39:27,29959,"Trump is cracking jokes in Tulsa about Covid-19, calling it ""kung flu"" which is not only racist but belittles the deaths of 122K Americans and the horrific loss for their families.",[],[],trump crack joke tulsa call kung flu racist belittles death american horrific loss family,,[],,,,,,,
4742,CaptCookie7,"michigan girl and im back on the twit! conservative. here for trump tweets and to laugh at memes! typo master -deal with it!
#kag",n.a,628,225,4688,2020-02-02 18:08:54,2020-06-21 04:09:47,2,@no1uno_d @weijia Nah we'll stick with ' the Chinese virus',[],"['@no1uno_d', '@weijia']",nah we'll stick chinese virus,,[],,,,,,,
4743,sophieelsworth,national personal finance writer & columnist @newscorp 🇦🇺 a penny saved is a penny earned. raised on a sheep farm. occasionally i’m on the small screen. 📺,"melbourne, victoria",1140,4416,7870,2009-06-01 01:17:01,2020-06-22 02:11:07,0,"Is there zero link between the Black Lives Matter protest on Sat, June 6 &amp; this ""second outbreak"" or is it just simply a coincidence two weeks on? And to those with covid-19 if they did protest do they have to honestly declare this? #victoria #COVID19Aus","['victoria', 'covid19aus']",[],zero link black live matter protest sit june amp second outbreak simply coincidence two week protest honestly declare,,"[{'score': 0.884998, 'tone_id': 'analytical', 'tone_name': 'Analytical'}]",,1.0,,,,,
4744,spencersbrook,n.a,n.a,137,261,126369,2015-03-08 03:09:53,2020-06-22 02:33:08,7483,"There were so many directions he could have gone- Covid-19, unemployment, the murder of George Floyd, systemic racism, global warming, etc. Instead he chose the ‘whiny victim’ route. THIS is our president????? We deserve better. Register to vote. https://t.co/zMdYhSBOMh",[],[],many direction could go unemployment murder george floyd systemic racism global warm etc instead chose ‘whiny victim’ route president deserve good register vote,,[],,,,,,,
4745,Assumptaleader,latest news as it drops #politics #national #local #foreign #sports #articles and lots more. the leader news online - assumpta press since 1956.,"owerri, imo state nigeria",1239,495,48890,2013-05-01 13:49:12,2020-06-22 01:21:36,0,"WHO confirms 293,721 COVID-19 cases, 7,778 deaths in Africa https://t.co/bLycTz6TZw",[],[],confirms case death in africa,,"[{'score': 0.637546, 'tone_id': 'sadness', 'tone_name': 'Sadness'}, {'score': 0.982476, 'tone_id': 'analytical', 'tone_name': 'Analytical'}]",,1.0,1.0,,,,
4746,LauraRibeiro171,i love the group #bts and i'm #army and i love #kpop in general. #bts #rm #suga #v #jin #jimin #jhope #jungkook,"franco da rocha, brasil",121,10,15762,2019-08-02 12:39:49,2020-06-23 01:09:14,141,".@BTS_twt and @BigHitEnt have donated $1M to the #CrewNation campaign, ""one of the largest artist donations"" since the fund began. The campaign supports live concert crews across the globe impacted by COVID-19. https://t.co/WLQgTknNBR",['crewnation'],"['@BTS_twt', '@BigHitEnt']",donate campaign one large artist donation since fund begin campaign support live concert crew across globe impact,,"[{'score': 0.583359, 'tone_id': 'joy', 'tone_name': 'Joy'}]",1.0,,,,,,
4747,RituDhand,"vice president editorial, nature journals. ex- chief biological sciences editor, nature. cancer molecular biologist; science communication. views are my own.",london,331,91,271,2011-05-26 12:09:16,2020-06-22 02:34:38,38,"Related, as flagged by @califf001, this analysis by @statnews shows how the timing of response to the pandemic greatly influenced outcomes: the vast majority of  US deaths could have been prevented
https://t.co/JJZ4fP5fSM by @jsebenius and Isaac Sebenius https://t.co/2DvZyUBIkf",[],"['@califf001,', '@statnews', '@jsebenius']","relate flag analysis show time response pandemic greatly influenced outcome vast majority death could prevented
 isaac sebenius","[{'sentence_id': 0, 'text': 'relate flag analysis show time response pandemic greatly influenced outcome vast majority death could prevented', 'tones': [{'score': 0.970179, 'tone_id': 'analytical', 'tone_name': 'Analytical'}]}, {'sentence_id': 1, 'text': ' isaac sebenius', 'tones': []}]","[{'score': 0.994849, 'tone_id': 'analytical', 'tone_name': 'Analytical'}, {'score': 0.770435, 'tone_id': 'tentative', 'tone_name': 'Tentative'}]",,1.0,,1.0,,,
4748,MarcoFnPolo,"8/17/16 🌭❤🍣
something beyond forever.",n.a,264,109,11519,2013-02-12 03:47:04,2020-06-21 02:38:23,505,"“Kellyanne Conway...called reports of a White House official referring to COVID-19 as the ‘kung flu’ virus ‘HIGHLY OFFENSIVE’ ... ‘I'd like to know who they are. But hold on, you can't just say that and not name them. Tell us who it was.’”

March 18, 2020

https://t.co/Zi24Xrqyl1 https://t.co/Dq95baSzT6",[],[],"“kellyanne conway...called report white house official refer ‘kung flu’ virus ‘highly offensive’ ‘i'd like know hold can't say name tell was.’”

march","[{'sentence_id': 0, 'text': ""“kellyanne conway...called report white house official refer ‘kung flu’ virus ‘highly offensive’ ‘i'd like know hold can't say name tell was.’”"", 'tones': [{'score': 0.653099, 'tone_id': 'analytical', 'tone_name': 'Analytical'}]}, {'sentence_id': 1, 'text': '', 'tones': []}, {'sentence_id': 2, 'text': 'march', 'tones': []}]","[{'score': 0.816179, 'tone_id': 'analytical', 'tone_name': 'Analytical'}]",,1.0,,,,,
4749,nikster007,"just a bloke who like his vodka and cigars. movies,cars, audio,f1.",hacienda  napoles,1606,5637,181432,2009-08-22 13:01:48,2020-06-22 03:39:00,0,Cipla also has a new Covid 19 drug. ? 😊,[],[],cipla also new covid drug,,[],,,,,,,
4750,devaraomugle,n.a,"adilabad, india",88,72,681,2016-09-12 08:36:30,2020-06-21 03:49:08,882,"Food for thought:
""COVID19 means that the Corona Virus has 19 points that can be applied on any country based on their level of immunity"" says Federal Minister for Climate Change. https://t.co/r0D2Jz2z8b",[],[],food mean corona virus point apply country base level immunity say federal minister climate change,,"[{'score': 0.520134, 'tone_id': 'sadness', 'tone_name': 'Sadness'}, {'score': 0.72085, 'tone_id': 'analytical', 'tone_name': 'Analytical'}]",,1.0,1.0,,,,
4751,cherrykoosenpai,"art in profile pic and layout are not mine (credits to the real artist!) i'm a multistan fan acc! i'm also a minor! 
backup : @cherrykoosbitch","14,she/her",1160,65,2523,2018-12-10 21:34:15,2020-06-22 02:12:58,55,hi everyone... I'm a little embarrassed to do this but recently I've been tested for COVID-19. I will be out of work for a month at a minimum and really need help financially to recover. if you can donate or share the link I would be forever thankful. https://t.co/OsRiKkahEZ,[],[],hi everyone i'm little embarrass recently i've test work month minimum really need help financially recover donate share link would forever thankful,,"[{'score': 0.561515, 'tone_id': 'sadness', 'tone_name': 'Sadness'}, {'score': 0.653099, 'tone_id': 'analytical', 'tone_name': 'Analytical'}, {'score': 0.579436, 'tone_id': 'confident', 'tone_name': 'Confident'}]",,1.0,1.0,,1.0,,
4752,AskAristolee,isang indibidwal na gusto maging abugago . . . este abugado,ricia,290,306,10044,2016-01-08 13:01:27,2020-06-22 02:33:36,43,"Vice President Leni Robredo (@lenirobredo) said any plan to phase out old jeepneys should not be pushed now as drivers are already struggling with the effects of the COVID-19 pandemic.

Read: https://t.co/zLXIs5zhka https://t.co/tciGWAwrdu",[],['@lenirobredo)'],"vice president leni robredo say plan phase old jeepneys push driver already struggle effect pandemic.

read","[{'sentence_id': 0, 'text': 'vice president leni robredo say plan phase old jeepneys push driver already struggle effect pandemic.', 'tones': [{'score': 0.692474, 'tone_id': 'sadness', 'tone_name': 'Sadness'}, {'score': 0.802757, 'tone_id': 'analytical', 'tone_name': 'Analytical'}]}, {'sentence_id': 1, 'text': 'read', 'tones': []}]","[{'score': 0.693, 'tone_id': 'sadness', 'tone_name': 'Sadness'}, {'score': 0.921915, 'tone_id': 'analytical', 'tone_name': 'Analytical'}]",,1.0,1.0,,,,
4753,javierg2035,n.a,n.a,880,102,22727,2011-06-24 14:18:19,2020-06-22 03:20:51,8085,"There were so many directions he could have gone- Covid-19, unemployment, the murder of George Floyd, systemic racism, global warming, etc. Instead he chose the ‘whiny victim’ route. THIS is our president????? We deserve better. Register to vote. https://t.co/zMdYhSBOMh",[],[],many direction could go unemployment murder george floyd systemic racism global warm etc instead chose ‘whiny victim’ route president deserve good register vote,,[],,,,,,,
4754,mexicanspacesh1,....told me....,n.a,728,431,22514,2019-07-22 22:24:13,2020-06-21 04:01:03,1962,"Why did the Washington Post all of a sudden remove the daily China Virus death tracker from its front page now that COVID deaths are decreasing nationwide?

I guess it just doesn’t fit their narrative anymore.

🤔",[],[],"washington post sudden remove daily china virus death tracker front page covid death decrease nationwide?

i guess doesn’t fit narrative anymore.

🤔","[{'sentence_id': 0, 'text': 'washington post sudden remove daily china virus death tracker front page covid death decrease nationwide?', 'tones': [{'score': 0.511428, 'tone_id': 'sadness', 'tone_name': 'Sadness'}]}, {'sentence_id': 1, 'text': 'i guess doesn’t fit narrative anymore.', 'tones': [{'score': 0.640493, 'tone_id': 'sadness', 'tone_name': 'Sadness'}, {'score': 0.946222, 'tone_id': 'tentative', 'tone_name': 'Tentative'}]}, {'sentence_id': 2, 'text': '🤔', 'tones': []}]","[{'score': 0.630541, 'tone_id': 'sadness', 'tone_name': 'Sadness'}, {'score': 0.893364, 'tone_id': 'tentative', 'tone_name': 'Tentative'}]",,,1.0,1.0,,,
4755,trump4ever20201,trump4ever,n.a,70,4,74,2020-06-17 03:15:10,2020-06-20 02:02:23,1002,"COVID FACTS
The virus can travel 6' it cannot go beyond 6'1, it can live on all surfaces except anything from Amazon, it does not live in Walmart, Home Depot, or any grocery store, it's only deadly in small businesses, churches &amp; Trump rallies, but it cannot harm you protesting",[],[],"covid facts
the virus travel cannot go beyond live surface except anything amazon live walmart home depot grocery store deadly small business church amp trump rally cannot harm protesting","[{'sentence_id': 0, 'text': 'covid facts', 'tones': [{'score': 0.997482, 'tone_id': 'analytical', 'tone_name': 'Analytical'}, {'score': 0.996934, 'tone_id': 'confident', 'tone_name': 'Confident'}]}, {'sentence_id': 1, 'text': 'the virus travel cannot go beyond live surface except anything amazon live walmart home depot grocery store deadly small business church amp trump rally cannot harm protesting', 'tones': []}]","[{'score': 0.86591, 'tone_id': 'analytical', 'tone_name': 'Analytical'}]",,1.0,,,,,
4756,fmtoday,free and independent #fmtnews,"üt: 3.099457,101.681025",2,151042,201869,2010-01-05 16:17:15,2020-06-21 02:42:08,0,President argues that increased tests will lead to more virus cases being discovered. #FMTNews #Coronavirus https://t.co/sHD8gxUtSl,"['fmtnews', 'coronavirus']",[],president argues increase test lead virus case discover,,"[{'score': 0.987, 'tone_id': 'analytical', 'tone_name': 'Analytical'}]",,1.0,,,,,
4757,DeejayLow,"turntablist / dj / producer / down to earth                     
video & music: dnb https://t.co/erqgyxxrju       house+techno https://t.co/zly1k0kh2e","kuala lumpur, malaysia",1896,1166,26848,2009-06-15 09:33:40,2020-06-21 02:21:15,32,"To All Trump fans in Tulsa, make sure you shake hands and hug your bredren ... don’t wear masks  because corona virus is a hoax ... duh!!! Also you should demand to shake the hand of your idol ... it would be VERY COOL to kiss and hug your POTUS right? 😘 go MAGA!!! 🇺🇸🇺🇸🇺🇸",[],[],trump fan tulsa make sure shake hand hug bredren don’t wear mask corona virus hoax duh also demand shake hand idol would cool kiss hug potus right go maga,,"[{'score': 0.636281, 'tone_id': 'joy', 'tone_name': 'Joy'}]",1.0,,,,,,
4758,MumbaiMirror,india's largest compact newspaper.,"mumbai, india",225,364636,66665,2012-12-05 11:37:45,2020-06-22 02:30:00,1,"The doctor was member of IMA’s Doctor Army that was set up to fight corona pandemic in the town.
#COVID #Covid_19
#COVID19 #coronavirus 

https://t.co/LaoUBBceXQ","['covid', 'covid_19', 'covid19', 'coronavirus']",[],"doctor member ima’s doctor army set fight corona pandemic town.
 

",,[],,,,,,,
4759,AngeliaSalzer,n.a,n.a,7,1,6,2020-04-11 13:28:18,2020-06-23 01:10:12,14,"Forget MLB's proposals and counter-proposals.

With COVID-19 surging, the right thing to do would be to not play at all, writes @stephapstein https://t.co/AS29EiIpAN",[],['@stephapstein'],"forget mlb's proposal counter-proposals.

with surge right thing would play writes","[{'sentence_id': 0, 'text': ""forget mlb's proposal counter-proposals."", 'tones': [{'score': 0.994057, 'tone_id': 'analytical', 'tone_name': 'Analytical'}]}, {'sentence_id': 1, 'text': 'with surge right thing would play writes', 'tones': []}]","[{'score': 0.988064, 'tone_id': 'analytical', 'tone_name': 'Analytical'}]",,1.0,,,,,
4760,daphine36,n.a,n.a,98,141,17574,2016-02-28 09:21:59,2020-06-22 01:39:54,80,Vice President Leni Robredo said that a jeepney phaseout now should not be pushed as drivers are already struggling with the effects of COVID-19 pandemic. | @GabrielLaluINQ https://t.co/IqfAfgWmvl,[],['@GabrielLaluINQ'],vice president leni robredo say jeepney phaseout push driver already struggle effect pandemic,,"[{'score': 0.723771, 'tone_id': 'sadness', 'tone_name': 'Sadness'}, {'score': 0.840228, 'tone_id': 'analytical', 'tone_name': 'Analytical'}]",,1.0,1.0,,,,
4761,Perfect4Me_,peace... positivity... mommy of 2 💛🤞🏼. snap : perfect4_mee,"sandusky, oh",945,367,18435,2011-12-29 17:01:28,2020-06-23 01:27:39,45833,The reason why America isn’t recovering from COVID-19 as quickly as other countries is because we are a country that values individualism over collectivism. Nobody here wants to do anything that is a minor inconvenience to them in order to protect their neighbors.,[],[],reason america isn’t recover quickly country country value individualism collectivism nobody want anything minor inconvenience order protect neighbor,,"[{'score': 0.5538, 'tone_id': 'tentative', 'tone_name': 'Tentative'}, {'score': 0.769135, 'tone_id': 'analytical', 'tone_name': 'Analytical'}]",,1.0,,1.0,,,
4762,theMJA,the medical journal of australia (mja) is australia's leading peer-reviewed general medical journal. rts are not endorsements. also tweeting for mja insight.,sydney australia,2020,20145,39776,2010-06-08 04:33:12,2020-06-22 03:24:00,0,"#COVID19 news in brief … latest from @NEJM, @JAMA_current, @BMJ_latest, @TheLancet &amp; @theMJA … #openaccess in InSight+ … https://t.co/trbBbo62iX #medtwitter https://t.co/RrW399AKDJ","['covid19', 'openaccess', 'medtwitter']","['@NEJM,', '@JAMA_current,', '@BMJ_latest,', '@TheLancet', '@theMJA']",news brief late amp insight,,"[{'score': 0.970179, 'tone_id': 'analytical', 'tone_name': 'Analytical'}]",,1.0,,,,,
4763,NP20193,"hate trump, right wing ideologies of any kind, abhor racism and don’t want the uk to leave the eu. fuck brexit. used to live in 🇬🇧 now 🇮🇳",n.a,1859,1494,38764,2019-07-31 05:46:19,2020-06-22 02:29:53,10316,"Here is Health Minister Helen Whately’s response to concerns from a student nurse

In it she says “student nurses are not deemed to be providing a service”

She wasn’t saying that when thousands of them joined the fight against Covid-19

Please RT so others can see https://t.co/v2Dj852ro4",[],[],"health minister helen whately’s response concern student nurse

in say “student nurse deem provide service”

she wasn’t say thousand join fight rt others see","[{'sentence_id': 0, 'text': 'health minister helen whately’s response concern student nurse', 'tones': [{'score': 0.762356, 'tone_id': 'analytical', 'tone_name': 'Analytical'}]}, {'sentence_id': 1, 'text': '', 'tones': []}, {'sentence_id': 2, 'text': 'in say “student nurse deem provide service”', 'tones': []}, {'sentence_id': 3, 'text': '', 'tones': []}, {'sentence_id': 4, 'text': 'she wasn’t say thousand join fight rt others see', 'tones': [{'score': 0.504943, 'tone_id': 'joy', 'tone_name': 'Joy'}]}]","[{'score': 0.517851, 'tone_id': 'joy', 'tone_name': 'Joy'}]",1.0,,,,,,
4764,grantschott,"i live in a city but heart still in the country. the government is not the enemy.  let's make it work & listen to truth and science, especially during pandemic",oregon,1610,640,13596,2010-01-19 15:17:34,2020-06-21 02:35:20,67,Plenty of room at Trump rally for social distancing. But there is none. And where are the masks? Trump campaign blames media for poor attendance b/c of stories about COVID. I think people already knew about that virus. The virus that’s a problem is Trump.,[],[],plenty room trump rally social distance none mask trump campaign blame medium poor attendance b/c story covid think people already know virus virus that’s problem trump,,"[{'score': 0.750465, 'tone_id': 'analytical', 'tone_name': 'Analytical'}]",,1.0,,,,,
4765,Blue_Bee_pllntr,"anti-trump, health care, anti-corruption
#voteblue",usa,6754,7094,24101,2018-10-21 14:46:22,2020-06-22 01:37:37,942,Texas Gov. Greg Abbott announces he’ll hold briefing about COVID-19 with limit press coverage on Monday at 2 pm. The Houston Chronicle and San Antonio Express-News once again not allowed to be there to ask questions despite both cities seeing huge spike in ICUs. https://t.co/Fsjmb5mPTD,[],[],texas gov greg abbott announces he’ll hold briefing limit press coverage monday pm houston chronicle san antonio express-news allow ask question despite city see huge spike icu,,"[{'score': 0.793846, 'tone_id': 'analytical', 'tone_name': 'Analytical'}]",,1.0,,,,,
4766,TreTrelawne,clairsentient | clairvoyant | casper da 👻 writer | content creator | conspirator | $tretrelawnetarot💳 ecclésiastique 11:2🕷#black_lives_matter,7th floor of the north tower ,712,435,4865,2019-12-01 15:46:06,2020-06-22 03:22:29,0,All thanks to Covid-19! Wake up y’all - the shit is not only a scam but it was PRE-PLANNED!!! https://t.co/iQJwgEEKaD,[],[],thanks wake y’all shit scam pre-planned,,"[{'score': 0.923204, 'tone_id': 'anger', 'tone_name': 'Anger'}]",,,,,,,1.0
