username,acctdesc,location,following,followers,totaltweets,usercreatedts,tweetcreatedts,retweetcount,text,hashtags,mentioned_users,cleaned_text,sentences_tone,document_tones,sadness,tentative,analytical,joy,confident,fear,anger
FanninBR,n.a,n.a,54,62,30182,2018-01-08 18:15:55,2020-06-21 02:19:34,817,"Why did the Washington Post all of a sudden remove the daily China Virus death tracker from its front page now that COVID deaths are decreasing nationwide?

I guess it just doesn’t fit their narrative anymore.

🤔",[],[],"washington post sudden remove daily china virus death tracker front page covid death decrease nationwide?

i guess doesn’t fit narrative anymore.

🤔","[{'sentence_id': 0, 'text': 'washington post sudden remove daily china virus death tracker front page covid death decrease nationwide?', 'tones': [{'score': 0.511428, 'tone_id': 'sadness', 'tone_name': 'Sadness'}]}, {'sentence_id': 1, 'text': 'i guess doesn’t fit narrative anymore.', 'tones': [{'score': 0.640493, 'tone_id': 'sadness', 'tone_name': 'Sadness'}, {'score': 0.946222, 'tone_id': 'tentative', 'tone_name': 'Tentative'}]}, {'sentence_id': 2, 'text': '🤔', 'tones': []}]","[{'score': 0.630541, 'tone_id': 'sadness', 'tone_name': 'Sadness'}, {'score': 0.893364, 'tone_id': 'tentative', 'tone_name': 'Tentative'}]",1.0,1.0,,,,,
ChrisMa93282593,"philly📍
maryland📍
plz get a life🙄✌🏾",n.a,62,18,782,2020-02-06 02:57:52,2020-06-23 01:08:28,0,"Republicans: We’re love only no hate cuz that’s what democrats are

DEMS: BLM TRANS RIGHTS DONATE TO YEMEN

REP: BLCKS R ANIMALS, BLOWS UP ABORTION CENTER, SHOOTS UP SCHOOLS AND LATIN COMMUNITY, POLICE BRUTALITY. NIGGERS, CONFEDERATE FLAG, LIBTARDS, MAGA, CHINESE VIRUS, GAY4HELL https://t.co/X2X7mK12cQ",[],[],"republican we’re love hate cuz that’s democrat are

dems blm trans right donate yemen

rep blcks animal blow abortion center shoot school latin community police brutality nigger confederate flag libtards maga chinese virus","[{'sentence_id': 0, 'text': 'republican we’re love hate cuz that’s democrat are', 'tones': [{'score': 0.613187, 'tone_id': 'anger', 'tone_name': 'Anger'}]}, {'sentence_id': 1, 'text': '', 'tones': []}, {'sentence_id': 2, 'text': 'dems blm trans right donate yemen', 'tones': []}, {'sentence_id': 3, 'text': '', 'tones': []}, {'sentence_id': 4, 'text': 'rep blcks animal blow abortion center shoot school latin community police brutality nigger confederate flag libtards maga chinese virus', 'tones': []}]",[],,,,,,,
jeanlodul,"animation and film producer, journalist, social manager, stapled, runner of heart,restaurant in houston, lover, and if i am scorpion my jeanlodul snapchat","iphone: 19.353844,-99.171661",3965,2893,112466,2009-01-20 21:09:18,2020-06-22 03:19:34,0,Texas sees weekend surge in COVID-19 hospitalizations as local officials consider mask orders https://t.co/biAU4h8z7V,[],[],texas see weekend surge hospitalization local official consider mask order,,"[{'score': 0.735673, 'tone_id': 'analytical', 'tone_name': 'Analytical'}]",,,1.0,,,,
PatriciaSCrens1,n.a,united states,35,436,149004,2016-10-02 04:23:05,2020-06-23 01:10:00,729,"As COVID-19 spread across the globe, many U.S. workers were hurt through no fault of their own.

As America recovers, President @realDonaldTrump won't allow blue-collar and middle-class workers to stay on the sidelines and be replaced by new foreign labor. https://t.co/A68ueVC88u https://t.co/tFRwGZE9jX",[],['@realDonaldTrump'],"spread across globe many u.s worker hurt fault own.

as america recovers president allow blue-collar middle-class worker stay sideline replace new foreign labor","[{'sentence_id': 0, 'text': 'spread across globe many u.s worker hurt fault own.', 'tones': [{'score': 0.745887, 'tone_id': 'sadness', 'tone_name': 'Sadness'}]}, {'sentence_id': 1, 'text': 'as america recovers president allow blue-collar middle-class worker stay sideline replace new foreign labor', 'tones': [{'score': 0.61476, 'tone_id': 'analytical', 'tone_name': 'Analytical'}]}]","[{'score': 0.652723, 'tone_id': 'sadness', 'tone_name': 'Sadness'}]",1.0,,,,,,
ForbesME,the homepage of the world's business leaders.,"office 302, al attar business ",10,692883,29455,2011-06-08 07:08:59,2020-06-22 01:40:00,1,"The giant Dubai-based ports operator DP World is ""preparing for the worst"" in the months ahead, as coronavirus inflicts the heaviest blow on global trade since World War II.
https://t.co/DuZnrMy2km",[],[],"giant dubai-based port operator dp world prepare bad month ahead coronavirus inflicts heavy blow global trade since world war ii.
",,"[{'score': 0.550499, 'tone_id': 'sadness', 'tone_name': 'Sadness'}]",1.0,,,,,,
lmramey,. ⭐️⭐️⭐️maga🇱🇷🇱🇷trump 2020 #wherewego1wegoall!,n.a,12448,11593,174202,2009-03-06 03:39:52,2020-06-20 01:59:10,1004,"COVID FACTS
The virus can travel 6' it cannot go beyond 6'1, it can live on all surfaces except anything from Amazon, it does not live in Walmart, Home Depot, or any grocery store, it's only deadly in small businesses, churches &amp; Trump rallies, but it cannot harm you protesting",[],[],"covid facts
the virus travel cannot go beyond live surface except anything amazon live walmart home depot grocery store deadly small business church amp trump rally cannot harm protesting","[{'sentence_id': 0, 'text': 'covid facts', 'tones': [{'score': 0.997482, 'tone_id': 'analytical', 'tone_name': 'Analytical'}, {'score': 0.996934, 'tone_id': 'confident', 'tone_name': 'Confident'}]}, {'sentence_id': 1, 'text': 'the virus travel cannot go beyond live surface except anything amazon live walmart home depot grocery store deadly small business church amp trump rally cannot harm protesting', 'tones': []}]","[{'score': 0.86591, 'tone_id': 'analytical', 'tone_name': 'Analytical'}]",,,1.0,,,,
imdirtcheap,#blacklivesmatter #fuckracists #pridemonth #neverforget1984,the right path,172,183,1565,2013-06-30 09:33:38,2020-06-23 01:26:47,46208,The reason why America isn’t recovering from COVID-19 as quickly as other countries is because we are a country that values individualism over collectivism. Nobody here wants to do anything that is a minor inconvenience to them in order to protect their neighbors.,[],[],reason america isn’t recover quickly country country value individualism collectivism nobody want anything minor inconvenience order protect neighbor,,"[{'score': 0.5538, 'tone_id': 'tentative', 'tone_name': 'Tentative'}, {'score': 0.769135, 'tone_id': 'analytical', 'tone_name': 'Analytical'}]",,1.0,1.0,,,,
bearsie1231,n.a,n.a,255,9,1631,2020-04-15 21:05:59,2020-06-21 02:18:04,834,"Why did the Washington Post all of a sudden remove the daily China Virus death tracker from its front page now that COVID deaths are decreasing nationwide?

I guess it just doesn’t fit their narrative anymore.

🤔",[],[],"washington post sudden remove daily china virus death tracker front page covid death decrease nationwide?

i guess doesn’t fit narrative anymore.

🤔","[{'sentence_id': 0, 'text': 'washington post sudden remove daily china virus death tracker front page covid death decrease nationwide?', 'tones': [{'score': 0.511428, 'tone_id': 'sadness', 'tone_name': 'Sadness'}]}, {'sentence_id': 1, 'text': 'i guess doesn’t fit narrative anymore.', 'tones': [{'score': 0.640493, 'tone_id': 'sadness', 'tone_name': 'Sadness'}, {'score': 0.946222, 'tone_id': 'tentative', 'tone_name': 'Tentative'}]}, {'sentence_id': 2, 'text': '🤔', 'tones': []}]","[{'score': 0.630541, 'tone_id': 'sadness', 'tone_name': 'Sadness'}, {'score': 0.893364, 'tone_id': 'tentative', 'tone_name': 'Tentative'}]",1.0,1.0,,,,,
n05whls,government & politics humor political news humor us & world news news,tucson az,409,316,56895,2016-05-22 00:49:18,2020-06-23 01:27:55,3,"@ProjectLincoln A's he promised, Trump has made America 1st...in covid-19: 2.4 million cases and 125,000 deaths to date!
#TrumFailure #MAGA
#Morons #ChaoticDisaster",[],['@ProjectLincoln'],"a's promise trump make america million case deaths date!
",,"[{'score': 0.57974, 'tone_id': 'sadness', 'tone_name': 'Sadness'}]",1.0,,,,,,
GoreLogangore,n.a,n.a,294,131,1178,2015-01-23 21:17:18,2020-06-22 03:21:43,29333,"Kentucky has used Covid-19 as an excuse to slash polling places for Tuesday’s vital primary to defeat #MitchMcConnell. There were 3500+. Now, there are 200. 

Jefferson County, where half the Black voters are, will have 1 polling place for 610,000+ voters.
https://t.co/mTJT1dSVP9",['mitchmcconnell'],[],"kentucky use excuse slash polling place tuesday’s vital primary defeat 

jefferson county half black voter poll place voters.
","[{'sentence_id': 0, 'text': 'kentucky use excuse slash polling place tuesday’s vital primary defeat ', 'tones': []}, {'sentence_id': 1, 'text': '', 'tones': []}, {'sentence_id': 2, 'text': 'jefferson county half black voter poll place voters.', 'tones': []}]",[],,,,,,,
angieluzzz,streamer~ facebook: angieluz atienza🐾instagram|tiktok: angieluzatienza🐾youtube: angieluz,aa💛,2474,3892,43289,2014-07-05 09:48:31,2020-06-22 02:13:28,8018,huhuhu I really miss how life was before the corona virus 🥺👉🏼👈🏼,[],[],huhuhu really miss life corona virus,,"[{'score': 0.88846, 'tone_id': 'sadness', 'tone_name': 'Sadness'}, {'score': 0.842108, 'tone_id': 'analytical', 'tone_name': 'Analytical'}]",1.0,,1.0,,,,
Mezuera,luiz. with a z not an s. 🇧🇷🗽🇺🇲 latinx. social justice luchador. mbmbambino. sxe. 🏴 he/him,boy mayor of parts unknown,440,41,3864,2017-02-18 23:51:00,2020-06-23 01:27:45,45746,The reason why America isn’t recovering from COVID-19 as quickly as other countries is because we are a country that values individualism over collectivism. Nobody here wants to do anything that is a minor inconvenience to them in order to protect their neighbors.,[],[],reason america isn’t recover quickly country country value individualism collectivism nobody want anything minor inconvenience order protect neighbor,,"[{'score': 0.5538, 'tone_id': 'tentative', 'tone_name': 'Tentative'}, {'score': 0.769135, 'tone_id': 'analytical', 'tone_name': 'Analytical'}]",,1.0,1.0,,,,
willymaint,"#maga dad, happily married 45 years to college sweetheart.",n.a,3727,3029,21348,2013-02-19 22:47:45,2020-06-21 02:28:29,738,"Why did the Washington Post all of a sudden remove the daily China Virus death tracker from its front page now that COVID deaths are decreasing nationwide?

I guess it just doesn’t fit their narrative anymore.

🤔",[],[],"washington post sudden remove daily china virus death tracker front page covid death decrease nationwide?

i guess doesn’t fit narrative anymore.

🤔","[{'sentence_id': 0, 'text': 'washington post sudden remove daily china virus death tracker front page covid death decrease nationwide?', 'tones': [{'score': 0.511428, 'tone_id': 'sadness', 'tone_name': 'Sadness'}]}, {'sentence_id': 1, 'text': 'i guess doesn’t fit narrative anymore.', 'tones': [{'score': 0.640493, 'tone_id': 'sadness', 'tone_name': 'Sadness'}, {'score': 0.946222, 'tone_id': 'tentative', 'tone_name': 'Tentative'}]}, {'sentence_id': 2, 'text': '🤔', 'tones': []}]","[{'score': 0.630541, 'tone_id': 'sadness', 'tone_name': 'Sadness'}, {'score': 0.893364, 'tone_id': 'tentative', 'tone_name': 'Tentative'}]",1.0,1.0,,,,,
AlieShekhu,"proud member #bld(u)
general secretary up

humane* 
naukri pesha mazdoor* 
incumbent*
eliminator*
creative_naughty_kool temp*
damn-- itz very xpensiv bëïng më😎",jhumka city - banana republic,1597,730,222664,2017-08-28 11:30:04,2020-06-21 03:23:51,1,"Rule 4: this is not the right time to criticise government... a deadly virus... Locusts are stalking. The Chinese.... The last thing your elected masters want is their 130 crore slaves to start acting like they know everything and their masters are idiots
 https://t.co/NAG4fruujS",[],[],"rule right time criticise government deadly virus locust stalk chinese last thing elect master want crore slave start act like know everything master idiots
",,"[{'score': 0.600499, 'tone_id': 'analytical', 'tone_name': 'Analytical'}]",,,1.0,,,,
BigDaddyFiji,"husband, father & big daddy...superfan of notre dame, iu basketball, st. louis cardinals and wabash college",n.a,1335,170,6925,2011-08-19 14:58:55,2020-06-21 04:15:17,1951,"Why did the Washington Post all of a sudden remove the daily China Virus death tracker from its front page now that COVID deaths are decreasing nationwide?

I guess it just doesn’t fit their narrative anymore.

🤔",[],[],"washington post sudden remove daily china virus death tracker front page covid death decrease nationwide?

i guess doesn’t fit narrative anymore.

🤔","[{'sentence_id': 0, 'text': 'washington post sudden remove daily china virus death tracker front page covid death decrease nationwide?', 'tones': [{'score': 0.511428, 'tone_id': 'sadness', 'tone_name': 'Sadness'}]}, {'sentence_id': 1, 'text': 'i guess doesn’t fit narrative anymore.', 'tones': [{'score': 0.640493, 'tone_id': 'sadness', 'tone_name': 'Sadness'}, {'score': 0.946222, 'tone_id': 'tentative', 'tone_name': 'Tentative'}]}, {'sentence_id': 2, 'text': '🤔', 'tones': []}]","[{'score': 0.630541, 'tone_id': 'sadness', 'tone_name': 'Sadness'}, {'score': 0.893364, 'tone_id': 'tentative', 'tone_name': 'Tentative'}]",1.0,1.0,,,,,
_teeemo,"conservative weeb that likes video games
psn:teeemo_00
steam:teeemo",why do you need to know,564,38,1218,2019-04-18 03:10:56,2020-06-22 01:20:09,1053,"Trump - Shut the border 
Media - You’re a racist 
Trump - Shut the border 
Media - You didn’t do it fast enough 

Media - Chinese Wuhan virus 
Trump- Chinese Virus 
Media - You’re a racist 

Media We need a leader to give hope 
Trump- Have hope 
Media - You’re giving false hope",[],[],"trump shut border 
media you’re racist 
trump shut border 
media didn’t fast enough 

media chinese wuhan virus 
trump chinese virus 
media you’re racist 

media need leader give hope 
trump hope 
media you’re give false hope","[{'sentence_id': 0, 'text': 'trump shut border ', 'tones': [{'score': 0.517317, 'tone_id': 'anger', 'tone_name': 'Anger'}]}, {'sentence_id': 1, 'text': 'media you’re racist ', 'tones': []}, {'sentence_id': 2, 'text': 'trump shut border ', 'tones': [{'score': 0.517317, 'tone_id': 'anger', 'tone_name': 'Anger'}]}, {'sentence_id': 3, 'text': 'media didn’t fast enough ', 'tones': []}, {'sentence_id': 4, 'text': '', 'tones': []}, {'sentence_id': 5, 'text': 'media chinese wuhan virus ', 'tones': []}, {'sentence_id': 6, 'text': 'trump chinese virus ', 'tones': []}, {'sentence_id': 7, 'text': 'media you’re racist ', 'tones': []}, {'sentence_id': 8, 'text': '', 'tones': []}, {'sentence_id': 9, 'text': 'media need leader give hope ', 'tones': [{'score': 0.968123, 'tone_id': 'tentative', 'tone_name': 'Tentative'}, {'score': 0.882284, 'tone_id': 'analytical', 'tone_name': 'Analytical'}]}, {'sentence_id': 10, 'text': 'trump hope ', 'tones': [{'score': 0.998976, 'tone_id': 'tentative', 'tone_name': 'Tentative'}]}, {'sentence_id': 11, 'text': 'media you’re give false hope', 'tones': [{'score': 0.968123, 'tone_id': 'tentative', 'tone_name': 'Tentative'}]}]","[{'score': 0.968547, 'tone_id': 'tentative', 'tone_name': 'Tentative'}]",,1.0,,,,,
vainglory___,| fsu 19| wp| so you think you can tell heaven from hell | instagram @vanity_jack |,greatest place on earth,197,151,15638,2012-01-25 14:12:32,2020-06-23 01:27:58,257,"Chris Howell was less than halfway into a 4-year sentence for stealing phone chargers from a West Palm Target.

He didn't die of old age, by suicide or of COVID-19.

Howell was killed by a corrections officer, who beat him while he was cuffed. 

My latest: https://t.co/lud1RGszwe",[],[],"chris howell less halfway sentence steal phone charger west palm target.

he die old age suicide kill correction officer beat cuffed 

my late","[{'sentence_id': 0, 'text': 'chris howell less halfway sentence steal phone charger west palm target.', 'tones': [{'score': 0.501981, 'tone_id': 'anger', 'tone_name': 'Anger'}]}, {'sentence_id': 1, 'text': 'he die old age suicide kill correction officer beat cuffed ', 'tones': [{'score': 0.815431, 'tone_id': 'sadness', 'tone_name': 'Sadness'}, {'score': 0.618451, 'tone_id': 'confident', 'tone_name': 'Confident'}]}, {'sentence_id': 2, 'text': '', 'tones': []}, {'sentence_id': 3, 'text': 'my late', 'tones': [{'score': 0.916667, 'tone_id': 'sadness', 'tone_name': 'Sadness'}]}]","[{'score': 0.684907, 'tone_id': 'sadness', 'tone_name': 'Sadness'}, {'score': 0.79901, 'tone_id': 'confident', 'tone_name': 'Confident'}]",1.0,,,,1.0,,
RandomMusingMom,"aspiring blogger, foodie, parent, organic, outdoor, self-realization, live in the now moment!","sf bay area, ca",126,109,8154,2011-01-09 19:46:07,2020-06-22 03:19:24,316,"Billionaires in the United States have regained $565B in wealth since the height of the COVID-19 crisis.

Much like in 2008, the wealthy elite is being bailed out while ordinary Americans are sold out.

We need a new stimulus package that helps all those who are struggling.",[],[],"billionaire united state regain wealth since height crisis.

much like wealthy elite bail ordinary american sell out.

we need new stimulus package help struggle","[{'sentence_id': 0, 'text': 'billionaire united state regain wealth since height crisis.', 'tones': [{'score': 0.506763, 'tone_id': 'analytical', 'tone_name': 'Analytical'}]}, {'sentence_id': 1, 'text': 'much like wealthy elite bail ordinary american sell out.', 'tones': [{'score': 0.615352, 'tone_id': 'tentative', 'tone_name': 'Tentative'}]}, {'sentence_id': 2, 'text': 'we need new stimulus package help struggle', 'tones': [{'score': 0.729619, 'tone_id': 'sadness', 'tone_name': 'Sadness'}]}]","[{'score': 0.664175, 'tone_id': 'tentative', 'tone_name': 'Tentative'}]",,1.0,,,,,
maureenm12,you haven't seen me on tv.,"los angeles, ca",1247,94,5063,2010-03-14 01:37:43,2020-06-22 03:42:47,23,"California broke two coronavirus records this weekend as the state reopens its economy:

- The most new infections in a single day since the start of the pandemic.

- The highest number of patients hospitalized with Covid-19 to date
https://t.co/n2axSI8yVc",[],[],"california break two coronavirus record weekend state reopens economy:

 new infection single day since start pandemic.

 high number patient hospitalize date
","[{'sentence_id': 0, 'text': 'california break two coronavirus record weekend state reopens economy:', 'tones': [{'score': 0.501384, 'tone_id': 'sadness', 'tone_name': 'Sadness'}]}, {'sentence_id': 1, 'text': '', 'tones': []}, {'sentence_id': 2, 'text': ' new infection single day since start pandemic.', 'tones': []}, {'sentence_id': 3, 'text': 'high number patient hospitalize date', 'tones': []}]",[],,,,,,,
Jeannie19641,"raised in military family. married military man.

still married to that man.
please, no direct messages.","south carolina, usa",2570,2319,68463,2019-10-29 22:56:54,2020-06-21 03:36:35,17,"Everybody was Kung Flu fighting.....🎼🎵🎶🎶🎵🎶🎵🎼
😂🤣😭🤣😂🤣😭🤣😂
I bet the fake news heads exploded when President Trump called it the ""Kung Flu"" and the ""Chinese Virus""! 🤣😭😂",[],[],"everybody kung flu fighting.....
🤣🤣🤣🤣
i bet fake news head explode president trump call kung flu chinese virus","[{'sentence_id': 0, 'text': 'everybody kung flu fighting.....', 'tones': []}, {'sentence_id': 1, 'text': '🤣🤣🤣🤣', 'tones': []}, {'sentence_id': 2, 'text': 'i bet fake news head explode president trump call kung flu chinese virus', 'tones': [{'score': 0.716301, 'tone_id': 'tentative', 'tone_name': 'Tentative'}]}]","[{'score': 0.928648, 'tone_id': 'tentative', 'tone_name': 'Tentative'}]",,1.0,,,,,
punkwig3,"#wwg1wga
#qanon
#aussieq",australia,4993,4209,12165,2015-12-28 22:30:02,2020-06-22 01:17:33,93,"@SteveScalise Q sent me. 

How is it possible select [D] governors thought it was 'safe' to push COVID-19 positive elderly patients back into nursing homes [hot zones]? https://t.co/o3JkmQe9BD",[],['@SteveScalise'],"send 

how possible select governor think safe push positive elderly patient back nurse home hot zone","[{'sentence_id': 0, 'text': 'send ', 'tones': []}, {'sentence_id': 1, 'text': '', 'tones': []}, {'sentence_id': 2, 'text': 'how possible select governor think safe push positive elderly patient back nurse home hot zone', 'tones': [{'score': 0.802757, 'tone_id': 'analytical', 'tone_name': 'Analytical'}]}]","[{'score': 0.921915, 'tone_id': 'analytical', 'tone_name': 'Analytical'}]",,,1.0,,,,
KelynSoong,@wcp sports editor/writer. former @postsports journalist. @uofmaryland alum. @aajadc national board rep. runner. email: ksoong@washingtoncitypaper.com,maryland,6117,5073,52307,2009-03-18 23:19:04,2020-06-22 02:14:30,30,"Dimitorov got Covid -19 are Thiem, Novak &amp; Zverev also getting tested?",[],[],dimitorov get covid thiem novak amp zverev also get test,,[],,,,,,,
samunddrang,you and your friends will die of old age,"saint petersburg, russia",498,710,132275,2010-04-24 16:59:43,2020-06-22 02:33:12,25018,Lack of taste is a symptom of covid-19 https://t.co/o2txxNFLn3,[],[],lack taste symptom,,"[{'score': 0.955445, 'tone_id': 'analytical', 'tone_name': 'Analytical'}]",,,1.0,,,,
GaySideWinder,n.a,"pennsylvania,  usa",2007,748,46811,2009-05-06 02:04:04,2020-06-20 02:52:51,25308,"Trump's rally in Tulsa is indoors, with no social distancing and no mask requirements—all in violation of CDC guidelines. Trump is willing to spread the COVID-19 virus in order to hear some cheers. He is a direct threat to the health of the American people. He must be defeated.",[],[],trump's rally tulsa indoors social distance mask requirements—all violation cdc guideline trump willing spread virus order hear cheer direct threat health american people must defeat,,"[{'score': 0.642915, 'tone_id': 'analytical', 'tone_name': 'Analytical'}, {'score': 0.674728, 'tone_id': 'confident', 'tone_name': 'Confident'}]",,,1.0,,1.0,,
shin59394320,rn bsn university of new mexico. not a bot and not a trump supporter. pissed off nurse tired of stupidity. officially #i love nasa #ilovespacex catholic.,bullhead city az,51,29,791,2020-05-23 17:31:11,2020-06-22 02:31:15,72,"Almost 1,000 people wait up to 13 hours for COVID-19 testing in Maryvale https://t.co/vT46dMcikL",[],[],almost people wait hour test maryvale,,"[{'score': 0.946222, 'tone_id': 'tentative', 'tone_name': 'Tentative'}]",,1.0,,,,,
Hubris18C,your friendly neighborhood weeb,wano country,312,421,44922,2013-07-06 05:28:21,2020-06-22 03:21:38,26196,Lack of taste is a symptom of covid-19 https://t.co/o2txxNFLn3,[],[],lack taste symptom,,"[{'score': 0.955445, 'tone_id': 'analytical', 'tone_name': 'Analytical'}]",,,1.0,,,,
KennSanon,"nothing to see here, just a young creatives of color, making a motion graphic novel and trying to put niqqas on dragons, one pay stub at a time.","orlando, fl, usa",210,263,13949,2017-09-26 07:05:02,2020-06-21 03:17:22,0,"#TulsaTrumpRally 
#TulsaDeathRally 

Corona Virus in the air picking out victims like https://t.co/TIMJ5pnxeN https://t.co/yVrrHN7y4E","['tulsatrumprally', 'tulsadeathrally']",[],"

corona virus air pick victim like",,"[{'score': 0.75152, 'tone_id': 'tentative', 'tone_name': 'Tentative'}, {'score': 0.842108, 'tone_id': 'analytical', 'tone_name': 'Analytical'}]",,1.0,1.0,,,,
abby9818,n.a,"florida, usa",5001,2106,147986,2009-04-13 22:18:25,2020-06-22 01:21:04,7616,"BREAKING UPDATE:  Florida sets another daily record with 4,671 new reported COVID-19 cases.",[],[],break update florida set another daily record new report case,,"[{'score': 0.704642, 'tone_id': 'confident', 'tone_name': 'Confident'}, {'score': 0.579367, 'tone_id': 'analytical', 'tone_name': 'Analytical'}]",,,1.0,,1.0,,
thejennybee,"freelance wordworker writing about arkansas, film, books, politics, life. my views are my own, but you're free to adopt them. i have extras. #resisters #resist","little rock, ar",2385,1460,12417,2009-01-22 13:13:17,2020-06-22 02:33:48,1082,"A cluster of mysterious deaths, some involving infants and children, is under scrutiny amid questions of whether the novel coronavirus lurked in California months before it was first detected. https://t.co/nYZ8ayT9fx",[],[],cluster mysterious death involve infant child scrutiny amid question whether novel coronavirus lurk california month first detect,,"[{'score': 0.834759, 'tone_id': 'analytical', 'tone_name': 'Analytical'}]",,,1.0,,,,
Julie29552471,"live in caregiver, autism aunt.  dog mom, animal lover! #biden2020 #resister #trumpmustgo","st cloud, mn",260,120,5965,2017-03-06 01:40:39,2020-06-22 01:36:32,6,"Can Donald Trump explain why Southern States like Florida, Georgia and Texas are showing an increase in Covid-19 cases? It should be worth noting that these states have Republican Governors.",[],[],donald trump explain southern state like florida georgia texas show increase case worth note state republican governor,,"[{'score': 0.825338, 'tone_id': 'analytical', 'tone_name': 'Analytical'}]",,,1.0,,,,
MikeLee_9999,n.a,n.a,48,9,867,2020-04-10 16:46:01,2020-06-21 02:26:05,0,"@HarleyRouda As Americans begin to sour on the constant protests and lawlessness, the left is back to their old trick: scaring people about the Chinese Virus. Reject them. They and the so-called “health experts” have lost all credibility. We’re moving ahead with full reopening. Screw them!",[],['@HarleyRouda'],american begin sour constant protest lawlessness leave back old trick scar people chinese virus reject so-called “health experts” lose credibility we’re move ahead full reopening screw,,[],,,,,,,
