username,acctdesc,location,following,followers,totaltweets,usercreatedts,tweetcreatedts,retweetcount,text,hashtags,mentioned_users,cleaned_text,sentences_tone,document_tones,sadness,tentative,analytical,joy,confident,fear,anger
EIBFNC,"constitutional conservative, catholic, shoot, hunt , fish, nra, http://t.co/geamgzxeda , http://t.co/xu64j8g040, buckeyes, golf  and guitars of course..","lagrange, ohio",5001,2931,33196,2010-03-21 22:15:47,2020-06-21 02:20:08,811,"Why did the Washington Post all of a sudden remove the daily China Virus death tracker from its front page now that COVID deaths are decreasing nationwide?

I guess it just doesn’t fit their narrative anymore.

🤔",[],[],"washington post sudden remove daily china virus death tracker front page covid death decrease nationwide?

i guess doesn’t fit narrative anymore.

🤔","[{'sentence_id': 0, 'text': 'washington post sudden remove daily china virus death tracker front page covid death decrease nationwide?', 'tones': [{'score': 0.511428, 'tone_id': 'sadness', 'tone_name': 'Sadness'}]}, {'sentence_id': 1, 'text': 'i guess doesn’t fit narrative anymore.', 'tones': [{'score': 0.640493, 'tone_id': 'sadness', 'tone_name': 'Sadness'}, {'score': 0.946222, 'tone_id': 'tentative', 'tone_name': 'Tentative'}]}, {'sentence_id': 2, 'text': '🤔', 'tones': []}]","[{'score': 0.630541, 'tone_id': 'sadness', 'tone_name': 'Sadness'}, {'score': 0.893364, 'tone_id': 'tentative', 'tone_name': 'Tentative'}]",1.0,1.0,,,,,
bobby48376115,old mother fucker,n.a,819,108,5931,2020-02-14 03:20:05,2020-06-22 02:11:42,194,"Fact-check: Biden was the VP, but he was not in charge of the Obama administration’s handling of the H1N1 pandemic. The polling is outdated (from pre-pandemic February 2020). Recent polling shows a decline in approval of Trump’s COVID-19 response. https://t.co/YOOKabSiDq https://t.co/aZLlazDjPB",[],[],fact-check biden vp charge obama administration’s handle pandemic polling outdated pre-pandemic february recent polling show decline approval trump’s response,,"[{'score': 0.572397, 'tone_id': 'analytical', 'tone_name': 'Analytical'}]",,,1.0,,,,
henry_huizar,🙂64k =•••==,united states,134,34,6851,2018-01-20 03:49:56,2020-06-23 01:08:06,91,"We have the data

COVID is no deadlier than the seasonal flu and barely affects the young

We also now know asymptomatic people don’t spread the virus

I’m healthy, no symptoms, and don’t care if I catch it

Thus, I’m not wearing a damn facemask",[],[],"data

covid deadlier seasonal flu barely affect young

we also know asymptomatic people don’t spread virus

i’m healthy symptom don’t care catch it

thus i’m wear damn facemask","[{'sentence_id': 0, 'text': 'data', 'tones': []}, {'sentence_id': 1, 'text': '', 'tones': []}, {'sentence_id': 2, 'text': 'covid deadlier seasonal flu barely affect young', 'tones': [{'score': 0.818823, 'tone_id': 'sadness', 'tone_name': 'Sadness'}, {'score': 0.681699, 'tone_id': 'tentative', 'tone_name': 'Tentative'}]}, {'sentence_id': 3, 'text': '', 'tones': []}, {'sentence_id': 4, 'text': 'we also know asymptomatic people don’t spread virus', 'tones': [{'score': 0.803567, 'tone_id': 'analytical', 'tone_name': 'Analytical'}]}, {'sentence_id': 5, 'text': '', 'tones': []}, {'sentence_id': 6, 'text': 'i’m healthy symptom don’t care catch it', 'tones': [{'score': 0.614411, 'tone_id': 'joy', 'tone_name': 'Joy'}]}, {'sentence_id': 7, 'text': '', 'tones': []}, {'sentence_id': 8, 'text': 'thus i’m wear damn facemask', 'tones': [{'score': 0.624778, 'tone_id': 'anger', 'tone_name': 'Anger'}]}]","[{'score': 0.842476, 'tone_id': 'sadness', 'tone_name': 'Sadness'}, {'score': 0.586281, 'tone_id': 'tentative', 'tone_name': 'Tentative'}]",1.0,1.0,,,,,
creappraiser,commercial real estate sales - listing agent - representing sellers and owners of commercial properties and valuation/appraisal consultant,"los angeles, ca",2472,748,5764,2012-12-18 08:09:41,2020-06-21 02:28:45,0,"Today in Oklahoma.  Trump said he early.  In late January.  Stopped people from China coming to the US.  Governor Cuomo straight out said spread of Covid from 3M Europeans.

‘The virus came from Europe and no one in this nation told us … It didn’t come from China’ — Gov. Cuomo https://t.co/Nvytp0iHE6",[],[],"today oklahoma trump say early late january stop people china come governor cuomo straight say spread covid europeans.

‘the virus come europe one nation tell didn’t come china’ gov cuomo","[{'sentence_id': 0, 'text': 'today oklahoma trump say early late january stop people china come governor cuomo straight say spread covid europeans.', 'tones': []}, {'sentence_id': 1, 'text': '‘the virus come europe one nation tell didn’t come china’ gov cuomo', 'tones': []}]","[{'score': 0.569551, 'tone_id': 'sadness', 'tone_name': 'Sadness'}]",1.0,,,,,,
lzhang39,rts = people more clever than i am,"williamsburg, brooklyn",337,376,7452,2009-09-22 23:13:03,2020-06-23 01:08:27,40970,The reason why America isn’t recovering from COVID-19 as quickly as other countries is because we are a country that values individualism over collectivism. Nobody here wants to do anything that is a minor inconvenience to them in order to protect their neighbors.,[],[],reason america isn’t recover quickly country country value individualism collectivism nobody want anything minor inconvenience order protect neighbor,,"[{'score': 0.5538, 'tone_id': 'tentative', 'tone_name': 'Tentative'}, {'score': 0.769135, 'tone_id': 'analytical', 'tone_name': 'Analytical'}]",,1.0,1.0,,,,
t4154kr,n.a,n.a,251,245,30870,2013-04-12 03:41:14,2020-06-22 02:29:46,8288,"BREAKING UPDATE:  Florida sets another daily record with 4,671 new reported COVID-19 cases.",[],[],break update florida set another daily record new report case,,"[{'score': 0.704642, 'tone_id': 'confident', 'tone_name': 'Confident'}, {'score': 0.579367, 'tone_id': 'analytical', 'tone_name': 'Analytical'}]",,,1.0,,1.0,,
tbChocolaTess,"hi, i'm kim!  welcome to my world, where there's sweet treats, healthy eats and sprinkles of inspiration and of course chocolate!",indiana,4779,3215,8770,2014-03-17 01:26:14,2020-06-22 01:39:56,38299,"Trump had a bad night in Tulsa. Very low turnout. Even his supporters know that COVID-19 is real and dangerous, and should not be spread at an indoor rally. More importantly, maybe people are catching on that he is a pathological liar and a fraud. Let's keep fighting.",[],[],trump bad night tulsa low turnout even supporter know real dangerous spread indoor rally importantly maybe people catch pathological liar fraud let's keep fighting,,"[{'score': 0.615352, 'tone_id': 'tentative', 'tone_name': 'Tentative'}]",,1.0,,,,,
ILAMHP,illinois association of medicaid health plans (iamhp) is a membership organization of health plans that participate in medicaid managed care in illinois.,"illinois, usa",172,140,1346,2017-07-06 14:13:09,2020-06-22 02:30:10,0,"Illinois Launching Contact Tracing Pilot Programs in Lake, St. Clair Counties | #IllinoisHealthcare #COVID_19 https://t.co/eGF5AalRS2","['illinoishealthcare', 'covid_19']",[],illinois launch contact trace pilot program lake st clair county,,"[{'score': 0.762356, 'tone_id': 'analytical', 'tone_name': 'Analytical'}]",,,1.0,,,,
KayDeeMmm,n.a,"severn, md",449,49,7006,2017-01-15 22:16:49,2020-06-20 03:00:56,25257,"Trump's rally in Tulsa is indoors, with no social distancing and no mask requirements—all in violation of CDC guidelines. Trump is willing to spread the COVID-19 virus in order to hear some cheers. He is a direct threat to the health of the American people. He must be defeated.",[],[],trump's rally tulsa indoors social distance mask requirements—all violation cdc guideline trump willing spread virus order hear cheer direct threat health american people must defeat,,"[{'score': 0.674728, 'tone_id': 'confident', 'tone_name': 'Confident'}, {'score': 0.642915, 'tone_id': 'analytical', 'tone_name': 'Analytical'}]",,,1.0,,1.0,,
LubsValente,nabucodonosor,italy,1748,147,6217,2009-07-14 02:52:43,2020-06-22 02:31:09,665,"46% of global Covid-19 deaths are recorded in 3 countries, which only account for 7.8% of global population.

What do they have in common? https://t.co/PqAHY0lAnI",[],[],"global death record country account global population.

what common","[{'sentence_id': 0, 'text': 'global death record country account global population.', 'tones': []}, {'sentence_id': 1, 'text': 'what common', 'tones': []}]",[],,,,,,,
edwinvvaladez,he/him/biiiitch. single dad with no kids. #blacklivesmatter,510,194,566,2807,2015-07-20 07:36:00,2020-06-23 01:07:41,41245,The reason why America isn’t recovering from COVID-19 as quickly as other countries is because we are a country that values individualism over collectivism. Nobody here wants to do anything that is a minor inconvenience to them in order to protect their neighbors.,[],[],reason america isn’t recover quickly country country value individualism collectivism nobody want anything minor inconvenience order protect neighbor,,"[{'score': 0.5538, 'tone_id': 'tentative', 'tone_name': 'Tentative'}, {'score': 0.769135, 'tone_id': 'analytical', 'tone_name': 'Analytical'}]",,1.0,1.0,,,,
DokistarKay,"stan talent, stan [insert kpop group here]",hopefully at home,132,48,6769,2019-03-24 16:02:46,2020-06-20 02:50:19,25320,"Trump's rally in Tulsa is indoors, with no social distancing and no mask requirements—all in violation of CDC guidelines. Trump is willing to spread the COVID-19 virus in order to hear some cheers. He is a direct threat to the health of the American people. He must be defeated.",[],[],trump's rally tulsa indoors social distance mask requirements—all violation cdc guideline trump willing spread virus order hear cheer direct threat health american people must defeat,,"[{'score': 0.674728, 'tone_id': 'confident', 'tone_name': 'Confident'}, {'score': 0.642915, 'tone_id': 'analytical', 'tone_name': 'Analytical'}]",,,1.0,,1.0,,
DidiB_NRA,"honest, reliable, loyal",nigeria,227,275,11514,2018-08-26 15:18:23,2020-06-21 02:25:47,0,@AprilDRyan @RealDLHughley He sure looks sick. Wishing him a speedy recovery from corona virus. May God be with him.,[],"['@AprilDRyan', '@RealDLHughley']",sure look sick wish speedy recovery corona virus may god,,[],,,,,,,
PoliticalLM,i do not sugar coat it. common sense approach to common sense,"texas, usa",178,1232,183,2016-01-08 20:45:17,2020-06-21 03:21:03,0,LOL THE CHINESE VIRUS,[],[],lol chinese virus,,"[{'score': 0.667442, 'tone_id': 'joy', 'tone_name': 'Joy'}]",,,,1.0,,,
JustinCzas,"tweets=mho;rt's,etc.≠agree;for:open questioning of authority,fact based reasoning&debate;oppose all free speech censorship.insults ignored.hypothesis≠conspiracy",united states,309,1429,80505,2013-04-29 22:00:09,2020-06-22 02:31:59,2,"NYC's Army Of 3,000 COVID-19 'Contact Tracers' Have Accomplished Surprisingly Little | Zero Hedge https://t.co/Krf7huvSW3",[],[],nyc's army contact tracer accomplish surprisingly little zero hedge,,[],,,,,,,
0101_mimurosugi,"他者を蔑むことが最近多いような気がします。
こんな理不尽な世の中をもう終わりにしたい。
★胡散臭いアカウントはありとあらゆる通報を行って凍結に追い込みます。
★このアカウントは、桜井市の今西酒造株式会社とは関係ありません。",n.a,1884,1883,94096,2016-02-08 10:22:07,2020-06-21 03:39:57,5,"The Kyoto Prefectural government has asked all marchers to scan this QR code and register for corona virus tracking. The questions are simple and provided in English. Please fill them out if you are planning to participate today.
#blmkyoto https://t.co/UvjztmRNoq",[],[],"kyoto prefectural government ask marcher scan qr code register corona virus track question simple provide english please fill plan participate today.
",,"[{'score': 0.746925, 'tone_id': 'analytical', 'tone_name': 'Analytical'}]",,,1.0,,,,
archdory,technology & science enthusiast. gamer & geek. amateur hiker & climber.,n.a,125,9,1801,2013-10-01 18:58:07,2020-06-21 04:21:09,5,"President Trump said tonight he’s asked his administration to slow down coronavirus testing because robust testing turns up too many cases of COVID-19, @AP reports https://t.co/BJ0rt9Dx0w",[],['@AP'],president trump say tonight he’s ask administration slow coronavirus test robust test turn many case report,,"[{'score': 0.518434, 'tone_id': 'sadness', 'tone_name': 'Sadness'}, {'score': 0.515917, 'tone_id': 'confident', 'tone_name': 'Confident'}]",1.0,,,,1.0,,
Ha_mee_da,\m/,"cleveland, oh",497,685,13901,2010-10-30 00:49:14,2020-06-22 03:20:59,26208,Lack of taste is a symptom of covid-19 https://t.co/o2txxNFLn3,[],[],lack taste symptom,,"[{'score': 0.955445, 'tone_id': 'analytical', 'tone_name': 'Analytical'}]",,,1.0,,,,
bayoubob,"painter- artist/designer,rver, progressive democrat, passionate non-theist, roaming ,but not lost!","bedford, ma",840,314,11212,2008-07-30 21:41:20,2020-06-21 03:58:52,10706,6 members of Trump's Tulsa advance staff have tested positive for COVID-19. Each may have infected hundreds with the virus already.,[],[],member trump's tulsa advance staff test positive may infect hundred virus already,,[],,,,,,,
rowdybats,"hi, it's alex-!! • 21 • (he/they)/she • ✂️ cosplayer + creator ✂️ • wig commissions: closed",💞@omnicheart💞 ,400,711,20093,2017-06-26 03:05:24,2020-06-23 01:26:39,46269,The reason why America isn’t recovering from COVID-19 as quickly as other countries is because we are a country that values individualism over collectivism. Nobody here wants to do anything that is a minor inconvenience to them in order to protect their neighbors.,[],[],reason america isn’t recover quickly country country value individualism collectivism nobody want anything minor inconvenience order protect neighbor,,"[{'score': 0.5538, 'tone_id': 'tentative', 'tone_name': 'Tentative'}, {'score': 0.769135, 'tone_id': 'analytical', 'tone_name': 'Analytical'}]",,1.0,1.0,,,,
Lile1321,"sickle cell patient
music is love music is life but god is everything 
rapper/producer
lil-e
diehard philly sports fan
wwe fan since 00'
mike scott hive 🐝🐝🐝",n.a,1600,317,7375,2011-06-14 02:37:03,2020-06-22 02:12:22,39744,"Trump had a bad night in Tulsa. Very low turnout. Even his supporters know that COVID-19 is real and dangerous, and should not be spread at an indoor rally. More importantly, maybe people are catching on that he is a pathological liar and a fraud. Let's keep fighting.",[],[],trump bad night tulsa low turnout even supporter know real dangerous spread indoor rally importantly maybe people catch pathological liar fraud let's keep fighting,,"[{'score': 0.615352, 'tone_id': 'tentative', 'tone_name': 'Tentative'}]",,1.0,,,,,
BjayukCat,"u.k. outback australia..now n z  i look for kindness, sharing, compassion, truth...it is so easy, and i promise it will make your day full of sunshine.no lists",new zealand,3052,3510,96521,2016-09-21 19:05:22,2020-06-20 03:11:17,0,"Live: Coronavirus Covid 19 update: Couple in their 20s the latest two cases of Covid-19, via @nzherald https://t.co/iOwzflVgZB N Z. is not free of the Covid 19 Virus.........",[],['@nzherald'],live coronavirus covid update couple late two case via free covid virus,,[],,,,,,,
SeldomSeen989,i am tired of watching society crumble because 1% (rich bastards) want more money. est quid ea dixit.🌊 #resistance,nowhere,1717,1211,22406,2011-01-27 04:11:53,2020-06-21 03:46:26,10487,6 members of Trump's Tulsa advance staff have tested positive for COVID-19. Each may have infected hundreds with the virus already.,[],[],member trump's tulsa advance staff test positive may infect hundred virus already,,[],,,,,,,
GaganPandit2601,"100% follow back
can't login old account due to some reason
https://t.co/eq7vak71fk",n.a,393,256,83,2020-06-17 07:44:08,2020-06-22 01:20:49,12,"Trump again blames China for Covid-19, terms it ‘Kung flu’

https://t.co/hKL9Qiltje https://t.co/s94rA8nN3d",[],[],"trump blame china term ‘kung flu’

",,[],,,,,,,
portaltopgyn,"acompanhe no topgyn notícias as últimas nacionais e internacionais. informações de todos os governos estaduais, justiça, economia, esporte e muito mais...",brasil - goiânia,114865,35781,818447,2009-08-22 20:14:39,2020-06-22 03:42:24,0,"Russian Coronavirus Vaccine to Protect Against COVID-19 For Over 2 Years, Developers Say - https://t.co/eGOvI0oMYN... https://t.co/cujL6YAVxq",[],[],russian coronavirus vaccine protect year developer say,,"[{'score': 0.801827, 'tone_id': 'analytical', 'tone_name': 'Analytical'}]",,,1.0,,,,
James_Gaddis,hakuna matata ig:jaygee2393 sc:james_gaddis,"pensacola, fl",199,371,33190,2011-01-11 20:46:05,2020-06-22 01:36:19,38397,"Trump had a bad night in Tulsa. Very low turnout. Even his supporters know that COVID-19 is real and dangerous, and should not be spread at an indoor rally. More importantly, maybe people are catching on that he is a pathological liar and a fraud. Let's keep fighting.",[],[],trump bad night tulsa low turnout even supporter know real dangerous spread indoor rally importantly maybe people catch pathological liar fraud let's keep fighting,,"[{'score': 0.615352, 'tone_id': 'tentative', 'tone_name': 'Tentative'}]",,1.0,,,,,
Poisonivy333,n.a,bklyn,1265,1155,8512,2012-07-20 12:36:23,2020-06-21 04:01:38,340,"When the President of the United States uses racist terms like Kung Flu, Chinese Virus, or China Plague, my biggest fear as an Asian American is that it normalizes racism against us and there’s no way for us to fight it. We have very little representation in government and media.",[],[],president united state us racist term like kung flu chinese virus china plague big fear asian american normalizes racism there’s way fight little representation government medium,,"[{'score': 0.552886, 'tone_id': 'fear', 'tone_name': 'Fear'}]",,,,,,1.0,
MikeHew69937763,"artist, sculptor,art designer,graphic designer. maga 'till  hell freezes.
( no porn)..",n.a,4946,3600,9439,2020-02-08 14:36:06,2020-06-21 02:23:33,60,"It really blows my mind how the media is going crazy right now talking about Covid being spread at the #TulsaTrumpRally but I didn’t see them being this enthusiastic about corona virus while thousands were getting together to riot, loot and burn their cities to the ground.",['tulsatrumprally'],[],really blow mind medium go crazy right talk covid spread didn’t see enthusiastic corona virus thousand get together riot loot burn city ground,,[],,,,,,,
properconvincer,i have a nation inside of me (coming soon)! @cnn doesn’t want us to know the truth so guess what we did? we followed president @realdonaldtrump #maga #wwg1wga,worldwide ,2919,2632,11559,2017-06-23 13:16:09,2020-06-21 02:34:00,1261,"Why did the Washington Post all of a sudden remove the daily China Virus death tracker from its front page now that COVID deaths are decreasing nationwide?

I guess it just doesn’t fit their narrative anymore.

🤔",[],[],"washington post sudden remove daily china virus death tracker front page covid death decrease nationwide?

i guess doesn’t fit narrative anymore.

🤔","[{'sentence_id': 0, 'text': 'washington post sudden remove daily china virus death tracker front page covid death decrease nationwide?', 'tones': [{'score': 0.511428, 'tone_id': 'sadness', 'tone_name': 'Sadness'}]}, {'sentence_id': 1, 'text': 'i guess doesn’t fit narrative anymore.', 'tones': [{'score': 0.640493, 'tone_id': 'sadness', 'tone_name': 'Sadness'}, {'score': 0.946222, 'tone_id': 'tentative', 'tone_name': 'Tentative'}]}, {'sentence_id': 2, 'text': '🤔', 'tones': []}]","[{'score': 0.630541, 'tone_id': 'sadness', 'tone_name': 'Sadness'}, {'score': 0.893364, 'tone_id': 'tentative', 'tone_name': 'Tentative'}]",1.0,1.0,,,,,
paerlkid,show me the most damaged parts of your soul and i will show you how it still shines like gold. [nikita gill],19 • she/her • fandoms + books,123,9,5796,2017-08-08 13:57:55,2020-06-22 03:21:06,151,"A couple of reminders:

- we're still in a global pandemic
- people are still dying
- healthy young people with no ""underlying health issues"" have died from covid
- even if you're fine, you might still spread the virus
- wear a mask in public
- wash/sanitise your hands",[],[],"couple reminders:

 we're still global pandemic
 people still dying
 healthy young people underlie health issue die covid
 even fine might still spread virus
 wear mask public
 wash/sanitise hand","[{'sentence_id': 0, 'text': 'couple reminders:', 'tones': []}, {'sentence_id': 1, 'text': '', 'tones': []}, {'sentence_id': 2, 'text': "" we're still global pandemic"", 'tones': []}, {'sentence_id': 3, 'text': ' people still dying', 'tones': []}, {'sentence_id': 4, 'text': ' healthy young people underlie health issue die covid', 'tones': [{'score': 0.68192, 'tone_id': 'sadness', 'tone_name': 'Sadness'}, {'score': 0.762356, 'tone_id': 'analytical', 'tone_name': 'Analytical'}]}, {'sentence_id': 5, 'text': ' even fine might still spread virus', 'tones': [{'score': 0.994446, 'tone_id': 'tentative', 'tone_name': 'Tentative'}]}, {'sentence_id': 6, 'text': ' wear mask public', 'tones': []}, {'sentence_id': 7, 'text': ' wash/sanitise hand', 'tones': []}]","[{'score': 0.948691, 'tone_id': 'tentative', 'tone_name': 'Tentative'}]",,1.0,,,,,
gramyc44,"god, family, country, 40 yrs. married #nra #1a #2a #military #vets #maga  #kag2020 #patriot #trump#proisrael  #blexit #buildthewall texttrump88022",united states,24675,23348,163806,2017-01-06 17:45:11,2020-06-21 02:42:55,107,"Why was it acceptable to speak out against your country without a mask but showing up to celebrate your country without a mask according to CNN has the potential of being a ""super spreader of the corona virus.""
Yet the mass riots didn't 🙄",[],[],"acceptable speak country without mask show celebrate country without mask accord cnn potential super spreader corona virus.""
yet mass riot","[{'sentence_id': 0, 'text': 'acceptable speak country without mask show celebrate country without mask accord cnn potential super spreader corona virus.""', 'tones': []}, {'sentence_id': 1, 'text': 'yet mass riot', 'tones': []}]",[],,,,,,,
BBendunski,"apprentice twitter commentator and inhabitant of earth. flat earth denialist, cemtrail chemist extraordinaire, 5g code writer & suspected non vegan.",head office,74,27,696,2020-04-04 21:18:17,2020-06-22 01:21:48,0,@nzlabour Well Wickety wickety wickety wak. Dust of the #turnardern Turntables J rock &amp; @nzlabour are going to turn the downturn around and keep it out of our country just like they did with Covid-19 oh yeah....... https://t.co/nJY74H6DdK,['turnardern'],"['@nzlabour', '@nzlabour']",well wickety wickety wickety wak dust turntable rock amp go turn downturn around keep country like oh yeah,,"[{'score': 0.75152, 'tone_id': 'tentative', 'tone_name': 'Tentative'}]",,1.0,,,,,
dathwathup,الموت لإسرائيل it should be,"urbana, il",169,64,674,2018-10-09 01:52:57,2020-06-22 02:12:40,39734,"Trump had a bad night in Tulsa. Very low turnout. Even his supporters know that COVID-19 is real and dangerous, and should not be spread at an indoor rally. More importantly, maybe people are catching on that he is a pathological liar and a fraud. Let's keep fighting.",[],[],trump bad night tulsa low turnout even supporter know real dangerous spread indoor rally importantly maybe people catch pathological liar fraud let's keep fighting,,"[{'score': 0.615352, 'tone_id': 'tentative', 'tone_name': 'Tentative'}]",,1.0,,,,,
mandarenae,add a bio to your profile,n.a,465,724,12584,2012-08-24 02:37:27,2020-06-22 02:32:22,30,"My cousin is currently battling COVID-19 and isn’t in the best condition so if you could retweet, share, or donate anything at all it would mean a lot! Thanks and stay safe https://t.co/e3L5OtxJWT",[],[],cousin currently battle isn’t best condition could retweet share donate anything would mean lot thanks stay safe,,"[{'score': 0.70783, 'tone_id': 'joy', 'tone_name': 'Joy'}, {'score': 0.925256, 'tone_id': 'tentative', 'tone_name': 'Tentative'}, {'score': 0.779757, 'tone_id': 'analytical', 'tone_name': 'Analytical'}]",,1.0,1.0,1.0,,,
soniarramirez10,sometimes i’m a little funny | σλγ ✨,n.a,779,843,7215,2012-06-18 03:05:35,2020-06-23 01:08:32,26579,"Black Lives Matter. 
COVID-19 still exists. 
Arrest the cops who murdered Breonna Taylor. 
Defund the police. 
Fund community org &amp; education.
Find Vanessa Guillén. 
Justice for Oluwatoyin Salau. 
Hold pedophiles &amp; rapists accountable. 

Thanks for coming to my TED talk.",[],[],"black live matter still exist 
arrest cop murder breonna taylor 
defund police 
fund community org amp education.
find vanessa guillén 
justice oluwatoyin salau 
hold pedophile amp rapist accountable 

thanks come ted talk","[{'sentence_id': 0, 'text': 'black live matter still exist ', 'tones': []}, {'sentence_id': 1, 'text': 'arrest cop murder breonna taylor ', 'tones': []}, {'sentence_id': 2, 'text': 'defund police ', 'tones': []}, {'sentence_id': 3, 'text': 'fund community org amp education.', 'tones': []}, {'sentence_id': 4, 'text': 'find vanessa guillén ', 'tones': [{'score': 0.955445, 'tone_id': 'analytical', 'tone_name': 'Analytical'}]}, {'sentence_id': 5, 'text': 'justice oluwatoyin salau ', 'tones': [{'score': 0.622945, 'tone_id': 'sadness', 'tone_name': 'Sadness'}]}, {'sentence_id': 6, 'text': 'hold pedophile amp rapist accountable ', 'tones': [{'score': 0.600355, 'tone_id': 'anger', 'tone_name': 'Anger'}]}, {'sentence_id': 7, 'text': '', 'tones': []}, {'sentence_id': 8, 'text': 'thanks come ted talk', 'tones': []}]",[],,,,,,,
